[{"question": "Vorrei delle informazioni riguardo l'ammontare della rata annuale per frequentare il Politecnico.", "ground_truths": ["Il contributo onnicomprensivo \u00e8 indicato nella sezione Contribuzione studentesca.\nL'importo dei soli contributi della seconda rata \u00e8 determinato in relazione alla fascia di contribuzione assegnata e dal numero di crediti formativi (CFU) che hai inserito nel Piano degli studi."], "contexts": ["Quanto si paga in un anno accademico\n\nPrima e seconda rata\n\nDetrazione spese universitarie\n\nRimborso delle tasse (a seguito di rinuncia agli studi)\n\nQuanto si paga in un anno accademico\n\nL\u2019importo delle tasse universitarie \u00e8 variabile in funzione del piano degli studi che presenterai e dalla condizione economica, determinata dall\u2019[ISEE](https://www.polimi.it/studenti-iscritti/tasse-borse-e-agevolazioni-economiche/contribuzione-studentesca/cose-lisee)\u00a0(Indicatore della Situazione Economica Equivalente).\u00a0Le rate sono due e vanno pagate ciascuna in un\u2019unica soluzione.\n\nCon un [piano degli studi standard](https://www.polimi.it/studenti-iscritti/piano-degli-studi-e-ofa-di-inglese-e-italiano/cose-il-piano-degli-studi)\u00a0tra i 46 e i 74 CFU (Credti Formativi Universitari) e un [ISEE](https://www.polimi.it/studenti-iscritti/tasse-borse-e-agevolazioni-economiche/contribuzione-studentesca/cose-lisee) fino a \u20ac 22.000, l\u2019importo \u00e8 di \u20ac 165.59; per Isee di valori superiori, l\u2019importo aumenta gradualmente fino ad un massimo di \u20ac 3.891,59. In particolare, per [ISEE](https://www.polimi.it/studenti-iscritti/tasse-borse-e-agevolazioni-economiche/contribuzione-studentesca/cose-lisee) compresi tra i \u20ac 22.001 e \u20ac 30.000 l\u2019importo \u00e8 calcolato con una [specifica formula](https://www.polimi.it/studenti-iscritti/tasse-borse-e-agevolazioni-economiche/contribuzione-studentesca/esoneri-previsti-dalla-legge-di-bilancio-2017); per [ISEE](https://www.polimi.it/studenti-iscritti/tasse-borse-e-agevolazioni-economiche/contribuzione-studentesca/cose-lisee) superiori a \u20ac 30.000, l\u2019importo \u00e8 definito in base alle [fasce di contribuzione](https://www.polimi.it/studenti-iscritti/tasse-borse-e-agevolazioni-economiche/contribuzione-studentesca/graduazione-del-contributo-onnicomprensivo). A questi importi viene poi applicata la [percentuale corrispondente al numero di CFU](https://www.polimi.it/studenti-iscritti/tasse-borse-e-agevolazioni-economiche/contribuzione-studentesca/commisurazione-dellimporto-onnicomprensivo-sulla-base-dei-cfu) del piano studi.\n\nN.B. Gli\u00a0studenti internazionali (appartenenti al contingente riservato extra UE, cio\u00e8 non equiparati agli studenti italiani), ammessi ai corsi di laurea magistrale con titolo di primo livello conseguito all\u2019estero che non sono assegnatari di una borsa di studio del Politecnico di Milano o di altri enti, o di borsa assegnata per merito e reddito del Diritto allo Studio, sono tenuti al pagamento dell\u2019importo massimo rapportato alla [percentuale corrispondente al numero di CFU](https://www.polimi.it/studenti-iscritti/tasse-borse-e-agevolazioni-economiche/contribuzione-studentesca/commisurazione-dellimporto-onnicomprensivo-sulla-base-dei-cfu) del piano degli studi.", "Gli studenti particolarmente capaci e meritevoli che si trovano in una determinata condizione economica, possono accedere anche ai benefici per il [Diritto allo Studio](https://www.polimi.it/studenti-iscritti/tasse-borse-e-agevolazioni-economiche/il-diritto-allo-studio-universitario-dsu).\n\nSe intendi iscriverti alla Laurea Online (IOL), segui le indicazioni riportate dal [sito del corso](http://www.laureaonline.polimi.it/tempi-e-costi/).\n\nPrima e seconda rata\n\nLa prima rata, per tutti i corsi di studio (laurea, laurea magistrale, ciclo unico), \u00e8 pari a \u20ac 888,59 e viene versata all\u2019atto dell\u2019immatricolazione. Tuttavia, \u00e8 prevista una riduzione di questo importo per ISEE con valore inferiore a \u20ac 27.740 e per ottenerla devi:\n\nrichiedere il [calcolo dell\u2019ISEE per uso universitario](https://www.polimi.it/studenti-iscritti/tasse-borse-e-agevolazioni-economiche/contribuzione-studentesca/cose-lisee) direttamente dal sito dell\u2019[INPS](https://www.inps.it/) (accedendo all'apposito servizio, che prevede anche la modalit\u00e0 precompilata dell'ISEE) oppure tramite un CAF (Centro Assistenza Fiscale)\n\ninserire nei [Servizi Online](https://aunicalogin.polimi.it/aunicalogin/getservizio.xml?id_servizio=376)\u00a0[Richieste di ammissione > Inserimento Isee per immatricolazione], almeno 10 giorni lavorativi prima dell\u2019immatricolazione, la data della sottoscrizione della Dichiarazione Sostitutiva Unica (\u00e8 la data in cui hai firmato quel documento che hai presentato all\u2019[INPS](https://www.inps.it/), direttamente o tramite CAF, per ottenere il calcolo dell\u2019ISEE)\n\nLa seconda rata generalmente si paga a\u00a0maggio, in base alle disposizioni definite ogni anno, indicate sullo [scadenzario](https://scadenziario.polimi.it/index.php?id=5&L=0&argomento=18) e viene calcolata tenendo conto di:\n\nnumero di crediti (CFU) contenuti nel piano degli studi\n\nfascia di reddito di appartenenza corrispondente all\u2019ISEE o, per chi ha redditi e patrimoni all\u2019estero, all\u2019estero e in Italia, [dall\u2019ISEEU-parificato](https://www.polimi.it/studenti-iscritti/tasse-borse-e-agevolazioni-economiche/contribuzione-studentesca/studenti-con-reddito-e-patrimonio-allestero)\n\nL\u2019importo della seconda rata varia da un minimo di \u20ac 0 a un massimo di \u20ac 3.003 (per un piano degli studi standard).", "Attenzione:\n\nper informazioni sulle tasse per i corsi singoli\u00a0visita la [sezione Futuri studenti](https://www.polimi.it/futuri-studenti/ammissione-ai-corsi-singoli)\n\nper gli studenti iscritti alla Laurea Online (IOL): l\u2019iscrizione alla Laurea in informatica OnLine prevede, oltre al pagamento della quota ordinaria (variabile in base al proprio reddito e al numero di crediti annuali previsti dal piano di studi), una quota fissa aggiuntiva di 1500 \u20ac annui per l\u2019accesso ai servizi online. Pertanto la prima rata per gli studenti che si iscriveranno al corso di laurea IOL sar\u00e0 pari a 1888,59 \u20ac. Consulta il sito [http://www.laureaonline.polimi.it/tempi-e-costi/](http://www.laureaonline.polimi.it/tempi-e-costi/)\n\nStudenti dipendenti della Pubblica Amministrazione\n\nPer gli studenti dipendenti della Pubblica Amministrazione che esprimono la volont\u00e0 di iscriversi aderendo al pagamento del contributo onnicomprensivo agevolato, l\u2019importo dovuto sar\u00e0 pari a 1.000 \u20ac, oltre al pagamento della tassa regionale, imposta di bollo e assicurazioni. L\u2019importo \u00e8 fisso e non dipendente da altri elementi della carriera (% CFU, graduazione del contributo onnicomprensivo, esonero sulla base della Legge 232/2016 e successive modifiche e integrazioni, ulteriori esoneri e particolari agevolazioni ecc.).\n\nSe iscritti alla Laurea in informatica OnLine (IOL), al contributo onnicomprensivo agevolato, sar\u00e0 dovuto anche l\u2019importo di 1.000 \u20ac per l\u2019utilizzo della piattaforma e servizio di tutorato dedicato. L\u2019adesione al contributo onnicomprensivo agevolato \u00e8 rinnovata automaticamente per gli anni accademici successivi, salvo espressa richiesta di revoca da parte dell\u2019interessato."], "answer": "L'importo delle tasse universitarie al Politecnico di Milano varia in base al piano di studi e alla condizione economica dello studente, determinata dall'ISEE (Indicatore della Situazione Economica Equivalente). Le tasse vengono pagate in due rate, ciascuna in un'unica soluzione.\n\nPer un piano di studi standard tra i 46 e i 74 CFU e un ISEE fino a \u20ac 22.000, l'importo \u00e8 di \u20ac 165.59. Per ISEE di valori superiori, l'importo aumenta gradualmente fino ad un massimo di \u20ac 3.891,59. Per ISEE compresi tra i \u20ac 22.001 e \u20ac 30.000, l'importo \u00e8 calcolato con una specifica formula. Per ISEE superiori a \u20ac 30.000, l'importo \u00e8 definito in base alle fasce di contribuzione. A questi importi viene poi applicata la percentuale corrispondente al numero di CFU del piano di studi.\n\nGli studenti internazionali (non equiparati agli studenti italiani) ammessi ai corsi di laurea magistrale con titolo di primo livello conseguito all'estero sono tenuti al pagamento dell'importo massimo rapportato alla percentuale corrispondente al numero di CFU del piano di studi.\n\nPer maggiori informazioni sulle tasse universitarie al Politecnico di Milano, puoi consultare il [sito ufficiale](https://www.polimi.it/futuri-studenti/tasse/lauree-e-lauree-magistrali).", "evaluation": {"faithfulness": 0.875, "answer_relevancy": 0.8508776245873175, "context_recall": 0.0, "answer_similarity": 1.0, "context_precision": 0.15625, "ragas_score": 0.0}}, {"question": "Come pagare le rate ?", "ground_truths": ["Dai Servizi Online Dati -Tasse e agevolazioni economiche - seleziona \"Ultima richiesta non pagata\", accedi alla piattaforma PagoPA e scegli tra i metodi di pagamento che ti verranno proposti."], "contexts": ["Come pagare le rate\n\ndalla tua pagina personale: \"Tasse universitarie\" > \"Ultima richiesta non pagata\", accedi alla piattaforma PagoPA, selezionando \u201cPaga tramite PagoPA \u201c- PAGA ON LINE:\u00a0scegli, tra i metodi di pagamento proposti, \"Altri metodi di pagamento\", optando tra le opzioni proposte in base alla verifica dei limiti delle stesse, o \"Addebito in conto\" (se la tua banca offre il servizio MyBank)\n\ndalla tua pagina personale: \"Tasse universitarie\" > \"Ultima richiesta non pagata\", seleziona \"Paga tramite PagoPA\" - PAGA PI\u00d9 TARDI:\u00a0seleziona \"Modulo di pagamento.pdf\" e con l'avviso di pagamento potrai effettuare l'operazione allo sportello della tua banca, o attraverso Home Banking con PagoPA o circuito CBILL utilizzando il codice interbancario: F9489, oppure presso sportelli ATM abilitati\n\ndalla tua pagina personale: \"Tasse universitarie\" > \"Ultima richiesta non pagata\", seleziona \"Paga tramite PagoPA\", scegli come metodo di pagamento [SCRIGNO PAGO FACILE](https://www.popso.it/app)\n\nAttenzione: si consiglia di verificare che le tempistiche legate alle diverse modalit\u00e0 di pagamento non comportino il superamento delle date di scadenza. Dopo avere pagato non \u00e8 necessario presentare in Segreteria alcun documento. Potrai controllare la registrazione dell\u2019avvenuto pagamento sui Servizi Online > Dati > Tasse e agevolazioni economiche > Storico pagamenti.", "Pagare la 1\u00b0 e la 2\u00b0 rata delle tasse\n\nTramite sistema [PagoPA](https://www.pagopa.gov.it/):\n\nattraverso i [[Servizi Online](https://aunicalogin.polimi.it/aunicalogin/getservizio.xml?id_servizio=376)](https://aunicalogin.polimi.it/aunicalogin/getservizio.xml?id_servizio=376)\n\ncon l'apposito modulo di pagamento nei [[Servizi Online](https://aunicalogin.polimi.it/aunicalogin/getservizio.xml?id_servizio=376)](https://aunicalogin.polimi.it/aunicalogin/getservizio.xml?id_servizio=376)\u00a0> Tasse e agevolazioni economiche > Ultima richiesta non pagata, utilizzabile presso i punti di pagamento convenzionati con il sistema [PagoPA](https://www.pagopa.gov.it/) (tutti i principali istituti di credito, tranne gli uffici di Poste Italiane)\n\nattraverso il sistema [PagoFacile](https://pagofacile.popso.it/)\u00a0nelle modalit\u00e0 di pagamento: \t-IUV utilizzando il Codice Avviso di Pagamento sulla stampa dell\u2019avviso \toppure \t-utilizzando il circuito CBILL con il codice interbancario: F9489\n\ntramite Poste Italiane - [Paga online](https://www.poste.it/paga-online.html), utilizzando il bollettino postale integrato negli avvisi di pagamento [PagoPA](https://www.pagopa.gov.it/)\n\nNote:\n\nIl pagamento della 2\u00b0 rata comporta l\u2019accettazione della fascia di contribuzione attribuita; non sar\u00e0 quindi possibile richiedere eventuali variazioni in diminuzione della fascia dopo aver effettuato il pagamento della 2\u00b0 rata\n\nPer importi inferiori a 12,00 \u20ac non sar\u00e0 disponibile nei [[Servizi Online](https://aunicalogin.polimi.it/aunicalogin/getservizio.xml?id_servizio=376)](https://aunicalogin.polimi.it/aunicalogin/getservizio.xml?id_servizio=376) il bollettino di pagamento, l\u2019importo dovuto sar\u00e0 automaticamente addebitato negli eventuali pagamenti successivi", "La scadenza per il pagamento della prima rata delle tasse dell'anno accademico 2023/2024 \u00e8 il 13 settembre 2023, fatta eccezione per gli studenti indicati qui di seguito.\n\nQUALI STUDENTI POSSONO PAGARE LA PRIMA RATA DELLE TASSE OLTRE LA SCADENZA DEL 13 SETTEMBRE 2023 SENZA INCORRERE NELLA MAGGIORAZIONE PER IL RITARDO?\n\nStudenti di Laurea (triennale)\n\nChi ha necessit\u00e0 di presentare un piano degli studi per l'anno accademico 2023/2024\u00a0\"identico\" (senza alcuna modifica) a quello dell'anno 2022/2023\u00a0al solo fine di poter sostenere esami del primo semestre a marzo 2024\n\nChi non riesce a laurearsi nella sessione di marzo 2024\n\nStudenti di Laurea Magistrale (biennale)\n\nChi ha la necessit\u00e0 di sostenere solo esami del primo semestre per i quali \u00e8 richiesta l\u2019iscrizione al nuovo anno accademico\n\nChi non riesce a laurearsi nella sessione di aprile 2024\n\nSolo per questi studenti la scadenza da rispettare per non incorrere nella maggiorazione \u00e8 il giorno 22 marzo 2024.\n\nAlcune operazioni amministrative potrebbero richiedere il pagamento della prima rata per poter procedere, ad esempio, all\u2019iscrizione (per gli studenti con un piano completo) agli appelli d\u2019esame dell'anno accademico 2023/2024 o alla registrazione in carriera dell'esito di un esame svolto in una sessione dell'anno accademico 2023/2024. Tali operazioni prevedono che sia stata pagata la rata di iscrizione, pertanto lo studente che si trova in una di queste situazioni dovr\u00e0 essere in regola con tutti i pagamenti."], "answer": "Per pagare le rate delle tasse universitarie, puoi seguire le seguenti procedure:\n\n1. Accedi alla tua pagina personale sui [Servizi Online](https://aunicalogin.polimi.it/aunicalogin/getservizio.xml?id_servizio=376).\n2. Seleziona la sezione \"Tasse universitarie\" e poi \"Ultima richiesta non pagata\".\n3. Da qui, avrai diverse opzioni per effettuare il pagamento:\n\n   - Paga online tramite PagoPA: seleziona \"Paga tramite PagoPA\" e segui le istruzioni per il pagamento online. Potrai scegliere tra diversi metodi di pagamento, come addebito in conto o altri metodi di pagamento disponibili.\n   - Paga pi\u00f9 tardi: seleziona \"Modulo di pagamento.pdf\" e potrai effettuare il pagamento allo sportello della tua banca o tramite Home Banking con PagoPA o circuito CBILL utilizzando il codice interbancario F9489.\n   - Paga tramite Scrigno Pago Facile: seleziona \"Paga tramite PagoPA\" e scegli come metodo di pagamento [Scrigno Pago Facile](https://www.popso.it/app).\n\nSi consiglia di verificare le tempistiche legate alle diverse modalit\u00e0 di pagamento per evitare il superamento delle date di scadenza. Dopo aver effettuato il pagamento, non \u00e8 necessario presentare alcun documento in Segreteria. Potrai controllare la registrazione dell'avvenuto pagamento sui Servizi Online nella sezione \"Dati\" > \"Tasse e agevolazioni economiche\" > \"Storico pagamenti\". Per ulteriori informazioni, puoi consultare la pagina dedicata sul sito del Politecnico di Milano [qui](https://www.polimi.it/studenti-iscritti/tasse-borse-e-agevolazioni-economiche/contribuzione-studentesca/scadenze-e-procedure-amministrative).", "evaluation": {"faithfulness": 0.4, "answer_relevancy": 0.8104526075902054, "context_recall": 0.0, "answer_similarity": 1.0, "context_precision": 0.25925925925925924, "ragas_score": 0.0}}, {"question": "Per pagare la 1\u00b0 e la 2\u00b0 rata posso utilizzare scrigno Pago Facile della Banca Popolare di Sondrio?", "ground_truths": ["Si, per farlo devi accedere al sito Pago Facile\n\nNelle modalit\u00e0 di pagamento:\n\n- IUV utilizzando il Codice Avviso di Pagamento sulla stampa dell\u2019avviso\noppure\n- utilizzando il circuito CBILL con il codice interbancario: F9489"], "contexts": ["Pagare la 1\u00b0 e la 2\u00b0 rata delle tasse\n\nTramite sistema [PagoPA](https://www.pagopa.gov.it/):\n\nattraverso i [[Servizi Online](https://aunicalogin.polimi.it/aunicalogin/getservizio.xml?id_servizio=376)](https://aunicalogin.polimi.it/aunicalogin/getservizio.xml?id_servizio=376)\n\ncon l'apposito modulo di pagamento nei [[Servizi Online](https://aunicalogin.polimi.it/aunicalogin/getservizio.xml?id_servizio=376)](https://aunicalogin.polimi.it/aunicalogin/getservizio.xml?id_servizio=376)\u00a0> Tasse e agevolazioni economiche > Ultima richiesta non pagata, utilizzabile presso i punti di pagamento convenzionati con il sistema [PagoPA](https://www.pagopa.gov.it/) (tutti i principali istituti di credito, tranne gli uffici di Poste Italiane)\n\nattraverso il sistema [PagoFacile](https://pagofacile.popso.it/)\u00a0nelle modalit\u00e0 di pagamento: \t-IUV utilizzando il Codice Avviso di Pagamento sulla stampa dell\u2019avviso \toppure \t-utilizzando il circuito CBILL con il codice interbancario: F9489\n\ntramite Poste Italiane - [Paga online](https://www.poste.it/paga-online.html), utilizzando il bollettino postale integrato negli avvisi di pagamento [PagoPA](https://www.pagopa.gov.it/)\n\nNote:\n\nIl pagamento della 2\u00b0 rata comporta l\u2019accettazione della fascia di contribuzione attribuita; non sar\u00e0 quindi possibile richiedere eventuali variazioni in diminuzione della fascia dopo aver effettuato il pagamento della 2\u00b0 rata\n\nPer importi inferiori a 12,00 \u20ac non sar\u00e0 disponibile nei [[Servizi Online](https://aunicalogin.polimi.it/aunicalogin/getservizio.xml?id_servizio=376)](https://aunicalogin.polimi.it/aunicalogin/getservizio.xml?id_servizio=376) il bollettino di pagamento, l\u2019importo dovuto sar\u00e0 automaticamente addebitato negli eventuali pagamenti successivi", "Come pagare le rate\n\ndalla tua pagina personale: \"Tasse universitarie\" > \"Ultima richiesta non pagata\", accedi alla piattaforma PagoPA, selezionando \u201cPaga tramite PagoPA \u201c- PAGA ON LINE:\u00a0scegli, tra i metodi di pagamento proposti, \"Altri metodi di pagamento\", optando tra le opzioni proposte in base alla verifica dei limiti delle stesse, o \"Addebito in conto\" (se la tua banca offre il servizio MyBank)\n\ndalla tua pagina personale: \"Tasse universitarie\" > \"Ultima richiesta non pagata\", seleziona \"Paga tramite PagoPA\" - PAGA PI\u00d9 TARDI:\u00a0seleziona \"Modulo di pagamento.pdf\" e con l'avviso di pagamento potrai effettuare l'operazione allo sportello della tua banca, o attraverso Home Banking con PagoPA o circuito CBILL utilizzando il codice interbancario: F9489, oppure presso sportelli ATM abilitati\n\ndalla tua pagina personale: \"Tasse universitarie\" > \"Ultima richiesta non pagata\", seleziona \"Paga tramite PagoPA\", scegli come metodo di pagamento [SCRIGNO PAGO FACILE](https://www.popso.it/app)\n\nAttenzione: si consiglia di verificare che le tempistiche legate alle diverse modalit\u00e0 di pagamento non comportino il superamento delle date di scadenza. Dopo avere pagato non \u00e8 necessario presentare in Segreteria alcun documento. Potrai controllare la registrazione dell\u2019avvenuto pagamento sui Servizi Online > Dati > Tasse e agevolazioni economiche > Storico pagamenti.", "Attenzione: l'emissione del bollettino di pagamento di seconda rata avverr\u00e0 indipendentemente dalla richiesta di assegnazione di una fascia inferiore al contributo pieno. Il pagamento in ritardo della rata comporter\u00e0 l\u2019attribuzione di un\u2019ulteriore maggiorazione dovuta in relazione al ritardo nel pagamento. In caso di registrazione in ritardo della sottoscrizione ISEE 2024, nei Servizi Online occorrer\u00e0 comunicare espressamente alla Segreteria studenti la necessit\u00e0 di generare un bollettino di pagamento aggiornato.\n\nIn mancanza di un ISEE valido e in ogni caso dopo il pagamento della seconda rata, non \u00e8 concessa nessuna riduzione del contributo onnicomprensivo pieno.\n\nMaggiori informazioni sull'ISEE\n\nL\u2019indicatore ISEE \u00e8 rilasciato dall\u2019INPS e puoi rivolgerti ad un CAF per avere assistenza e supporto. Puoi trovare tutte le informazioni necessarie ed un simulatore per il calcolo sul sito dell'INPS> Prestazioni e servizi > Tutti i servizi > [ISEE Post-riforma 2015](https://servizi2.inps.it/servizi/iseeriforma/home.aspx). L\u2019ISEE deve essere rilasciato \"uso Universit\u00e0\" in riferimento al codice fiscale dello studente e non deve contenere \u201comissioni/difformit\u00e0/discordanze\u201d. Gli studenti sono obbligati a dichiarare tutti i redditi, il patrimonio mobiliare e immobiliare previsti dalla normativa ISEE e sono responsabili della completezza e della conformit\u00e0 alla normativa citata della propria dichiarazione ISEE.\n\n[Maggiori informazioni](https://www.polimi.it/studenti-iscritti/tasse-borse-e-agevolazioni-economiche/contribuzione-studentesca/cose-lisee)"], "answer": "S\u00ec, puoi utilizzare Scrigno Pago Facile della Banca Popolare di Sondrio per pagare la 1\u00b0 e la 2\u00b0 rata delle tasse universitarie. Per ulteriori informazioni sulle modalit\u00e0 di pagamento, ti consiglio di consultare il sito ufficiale di POLIMI al seguente link: [Pagare la 1\u00b0 e la 2\u00b0 rata delle tasse](https://www.polimi.it/studenti-iscritti/tasse-borse-e-agevolazioni-economiche/contribuzione-studentesca/scadenze-e-procedure-amministrative)", "evaluation": {"faithfulness": 1.0, "answer_relevancy": 0.8948492073071296, "context_recall": 0.2, "answer_similarity": 1.0, "context_precision": 0.038461538461538464, "ragas_score": 0.14655232697549278}}, {"question": "Se l'importo dovuto supera il plafond della mia carta di credito come posso fare?", "ground_truths": ["In alternativa puoi utilizzare la POLICARD con l\u2019importo richiesto\nConsulta le informazioni relative a PagoPA"], "contexts": ["Come pagare le rate\n\ndalla tua pagina personale: \"Tasse universitarie\" > \"Ultima richiesta non pagata\", accedi alla piattaforma PagoPA, selezionando \u201cPaga tramite PagoPA \u201c- PAGA ON LINE:\u00a0scegli, tra i metodi di pagamento proposti, \"Altri metodi di pagamento\", optando tra le opzioni proposte in base alla verifica dei limiti delle stesse, o \"Addebito in conto\" (se la tua banca offre il servizio MyBank)\n\ndalla tua pagina personale: \"Tasse universitarie\" > \"Ultima richiesta non pagata\", seleziona \"Paga tramite PagoPA\" - PAGA PI\u00d9 TARDI:\u00a0seleziona \"Modulo di pagamento.pdf\" e con l'avviso di pagamento potrai effettuare l'operazione allo sportello della tua banca, o attraverso Home Banking con PagoPA o circuito CBILL utilizzando il codice interbancario: F9489, oppure presso sportelli ATM abilitati\n\ndalla tua pagina personale: \"Tasse universitarie\" > \"Ultima richiesta non pagata\", seleziona \"Paga tramite PagoPA\", scegli come metodo di pagamento [SCRIGNO PAGO FACILE](https://www.popso.it/app)\n\nAttenzione: si consiglia di verificare che le tempistiche legate alle diverse modalit\u00e0 di pagamento non comportino il superamento delle date di scadenza. Dopo avere pagato non \u00e8 necessario presentare in Segreteria alcun documento. Potrai controllare la registrazione dell\u2019avvenuto pagamento sui Servizi Online > Dati > Tasse e agevolazioni economiche > Storico pagamenti.", "Per ottenere una riduzione dell\u2019importo massimo della seconda rata devi:\n\nrichiedere, a partire da gennaio, un nuovo calcolo dell\u2019ISEE per uso universitario all\u2019INPS o a un CAF; se hai redditi o patrimoni all\u2019estero o all\u2019estero e in Italia, devi richiedere il calcolo [dell\u2019ISEEU parificato](https://www.polimi.it/studenti-iscritti/tasse-borse-e-agevolazioni-economiche/contribuzione-studentesca/studenti-con-reddito-e-patrimonio-allestero) secondo le procedure descritte nella pagina dedicata\n\nin attesa di ricevere l\u2019ISEE, devi inserire nei [Servizi Online](https://aunicalogin.polimi.it/aunicalogin/getservizio.xml?id_servizio=376)\u00a0[Dati >Tasse e agevolazioni economiche > Dichiarazione ISEE], la data della sottoscrizione della Dichiarazione Sostitutiva Unica\n\nAttenzione: l\u2019importo massimo \u00e8 richiesto in automatico agli studenti che non presentano un ISEE e agli studenti internazionali (appartenenti al contingente riservato Extra UE, cio\u00e8 non equiparati agli studenti italiani), iscritti ai corsi di Laurea Magistrale\u00a0con titolo di primo livello conseguito all\u2019estero\u00a0e non\u00a0assegnatari di una Borsa di studio del Politecnico di Milano o di altri Enti, anche se presentano ISEEU parificato.\n\nLa seconda rata con il relativo importo sar\u00e0 disponibile nei [Servizi Online](https://aunicalogin.polimi.it/aunicalogin/getservizio.xml?id_servizio=376), indicativamente un mese prima rispetto alla [scadenza](https://scadenziario.polimi.it/index.php?id=5&L=0) per il pagamento, da effettuare, entro i termini previsti, accedendo ai [Servizi Online](https://aunicalogin.polimi.it/aunicalogin/getservizio.xml?id_servizio=376) (Dati >Tasse e agevolazioni economiche > selezionando \"Ultima richiesta non pagata\").\n\nSe vuoi approfondire la questione delle rate, visita la [sezione dedicata alla contribuzione studentesca](https://www.polimi.it/studenti-iscritti/tasse-borse-e-agevolazioni-economiche/contribuzione-studentesca/studenti-con-reddito-e-patrimonio-allestero).", "Pagare la 1\u00b0 e la 2\u00b0 rata delle tasse\n\nTramite sistema [PagoPA](https://www.pagopa.gov.it/):\n\nattraverso i [[Servizi Online](https://aunicalogin.polimi.it/aunicalogin/getservizio.xml?id_servizio=376)](https://aunicalogin.polimi.it/aunicalogin/getservizio.xml?id_servizio=376)\n\ncon l'apposito modulo di pagamento nei [[Servizi Online](https://aunicalogin.polimi.it/aunicalogin/getservizio.xml?id_servizio=376)](https://aunicalogin.polimi.it/aunicalogin/getservizio.xml?id_servizio=376)\u00a0> Tasse e agevolazioni economiche > Ultima richiesta non pagata, utilizzabile presso i punti di pagamento convenzionati con il sistema [PagoPA](https://www.pagopa.gov.it/) (tutti i principali istituti di credito, tranne gli uffici di Poste Italiane)\n\nattraverso il sistema [PagoFacile](https://pagofacile.popso.it/)\u00a0nelle modalit\u00e0 di pagamento: \t-IUV utilizzando il Codice Avviso di Pagamento sulla stampa dell\u2019avviso \toppure \t-utilizzando il circuito CBILL con il codice interbancario: F9489\n\ntramite Poste Italiane - [Paga online](https://www.poste.it/paga-online.html), utilizzando il bollettino postale integrato negli avvisi di pagamento [PagoPA](https://www.pagopa.gov.it/)\n\nNote:\n\nIl pagamento della 2\u00b0 rata comporta l\u2019accettazione della fascia di contribuzione attribuita; non sar\u00e0 quindi possibile richiedere eventuali variazioni in diminuzione della fascia dopo aver effettuato il pagamento della 2\u00b0 rata\n\nPer importi inferiori a 12,00 \u20ac non sar\u00e0 disponibile nei [[Servizi Online](https://aunicalogin.polimi.it/aunicalogin/getservizio.xml?id_servizio=376)](https://aunicalogin.polimi.it/aunicalogin/getservizio.xml?id_servizio=376) il bollettino di pagamento, l\u2019importo dovuto sar\u00e0 automaticamente addebitato negli eventuali pagamenti successivi"], "answer": "Se l'importo dovuto supera il plafond della tua carta di credito, ci sono diverse opzioni che puoi considerare:\n\n1. Utilizzare un'altra carta di credito con un plafond pi\u00f9 alto, se ne possiedi una.\n\n2. Contattare la tua banca per richiedere un aumento temporaneo del plafond della tua carta di credito.\n\n3. Effettuare il pagamento utilizzando un'altra forma di pagamento, come bonifico bancario o pagamento in contanti presso uno sportello bancario. Per ulteriori informazioni su come effettuare il pagamento delle tasse, puoi consultare la pagina [Pagamento delle tasse](https://www.polimi.it/studenti-iscritti/tasse-borse-e-agevolazioni-economiche/contribuzione-studentesca/scadenze-e-procedure-amministrative).\n\nRicorda che \u00e8 importante rispettare le scadenze dei pagamenti per evitare eventuali sanzioni o problemi con la tua iscrizione. Se hai ulteriori domande o dubbi, ti consiglio di contattare direttamente il servizio tasse del Politecnico di Milano.", "evaluation": {"faithfulness": 0.5, "answer_relevancy": 0.9492958856206721, "context_recall": 0.5, "answer_similarity": 1.0, "context_precision": 0.09090909090909091, "ragas_score": 0.2931964524391016}}, {"question": "Ho dimenticato di pagare la rata quanto dovr\u00f2 pagare di maggiorazione?", "ground_truths": ["L\u2019importo della mora varia in proporzione all\u2019entit\u00e0 del ritardo e pu\u00f2 essere pari ad un valore massimo di 110,00 \u20ac, cos\u00ec come riportato nella sezione Maggiorazioni dovute a ritardi \nTale importo verr\u00e0 addebitato sulla prima richiesta di pagamento successiva."], "contexts": ["La scadenza per il pagamento della prima rata delle tasse dell'anno accademico 2023/2024 \u00e8 il 13 settembre 2023, fatta eccezione per gli studenti indicati qui di seguito.\n\nQUALI STUDENTI POSSONO PAGARE LA PRIMA RATA DELLE TASSE OLTRE LA SCADENZA DEL 13 SETTEMBRE 2023 SENZA INCORRERE NELLA MAGGIORAZIONE PER IL RITARDO?\n\nStudenti di Laurea (triennale)\n\nChi ha necessit\u00e0 di presentare un piano degli studi per l'anno accademico 2023/2024\u00a0\"identico\" (senza alcuna modifica) a quello dell'anno 2022/2023\u00a0al solo fine di poter sostenere esami del primo semestre a marzo 2024\n\nChi non riesce a laurearsi nella sessione di marzo 2024\n\nStudenti di Laurea Magistrale (biennale)\n\nChi ha la necessit\u00e0 di sostenere solo esami del primo semestre per i quali \u00e8 richiesta l\u2019iscrizione al nuovo anno accademico\n\nChi non riesce a laurearsi nella sessione di aprile 2024\n\nSolo per questi studenti la scadenza da rispettare per non incorrere nella maggiorazione \u00e8 il giorno 22 marzo 2024.\n\nAlcune operazioni amministrative potrebbero richiedere il pagamento della prima rata per poter procedere, ad esempio, all\u2019iscrizione (per gli studenti con un piano completo) agli appelli d\u2019esame dell'anno accademico 2023/2024 o alla registrazione in carriera dell'esito di un esame svolto in una sessione dell'anno accademico 2023/2024. Tali operazioni prevedono che sia stata pagata la rata di iscrizione, pertanto lo studente che si trova in una di queste situazioni dovr\u00e0 essere in regola con tutti i pagamenti.", "Come pagare le rate\n\ndalla tua pagina personale: \"Tasse universitarie\" > \"Ultima richiesta non pagata\", accedi alla piattaforma PagoPA, selezionando \u201cPaga tramite PagoPA \u201c- PAGA ON LINE:\u00a0scegli, tra i metodi di pagamento proposti, \"Altri metodi di pagamento\", optando tra le opzioni proposte in base alla verifica dei limiti delle stesse, o \"Addebito in conto\" (se la tua banca offre il servizio MyBank)\n\ndalla tua pagina personale: \"Tasse universitarie\" > \"Ultima richiesta non pagata\", seleziona \"Paga tramite PagoPA\" - PAGA PI\u00d9 TARDI:\u00a0seleziona \"Modulo di pagamento.pdf\" e con l'avviso di pagamento potrai effettuare l'operazione allo sportello della tua banca, o attraverso Home Banking con PagoPA o circuito CBILL utilizzando il codice interbancario: F9489, oppure presso sportelli ATM abilitati\n\ndalla tua pagina personale: \"Tasse universitarie\" > \"Ultima richiesta non pagata\", seleziona \"Paga tramite PagoPA\", scegli come metodo di pagamento [SCRIGNO PAGO FACILE](https://www.popso.it/app)\n\nAttenzione: si consiglia di verificare che le tempistiche legate alle diverse modalit\u00e0 di pagamento non comportino il superamento delle date di scadenza. Dopo avere pagato non \u00e8 necessario presentare in Segreteria alcun documento. Potrai controllare la registrazione dell\u2019avvenuto pagamento sui Servizi Online > Dati > Tasse e agevolazioni economiche > Storico pagamenti.", "Pagare la 1\u00b0 e la 2\u00b0 rata delle tasse\n\nTramite sistema [PagoPA](https://www.pagopa.gov.it/):\n\nattraverso i [[Servizi Online](https://aunicalogin.polimi.it/aunicalogin/getservizio.xml?id_servizio=376)](https://aunicalogin.polimi.it/aunicalogin/getservizio.xml?id_servizio=376)\n\ncon l'apposito modulo di pagamento nei [[Servizi Online](https://aunicalogin.polimi.it/aunicalogin/getservizio.xml?id_servizio=376)](https://aunicalogin.polimi.it/aunicalogin/getservizio.xml?id_servizio=376)\u00a0> Tasse e agevolazioni economiche > Ultima richiesta non pagata, utilizzabile presso i punti di pagamento convenzionati con il sistema [PagoPA](https://www.pagopa.gov.it/) (tutti i principali istituti di credito, tranne gli uffici di Poste Italiane)\n\nattraverso il sistema [PagoFacile](https://pagofacile.popso.it/)\u00a0nelle modalit\u00e0 di pagamento: \t-IUV utilizzando il Codice Avviso di Pagamento sulla stampa dell\u2019avviso \toppure \t-utilizzando il circuito CBILL con il codice interbancario: F9489\n\ntramite Poste Italiane - [Paga online](https://www.poste.it/paga-online.html), utilizzando il bollettino postale integrato negli avvisi di pagamento [PagoPA](https://www.pagopa.gov.it/)\n\nNote:\n\nIl pagamento della 2\u00b0 rata comporta l\u2019accettazione della fascia di contribuzione attribuita; non sar\u00e0 quindi possibile richiedere eventuali variazioni in diminuzione della fascia dopo aver effettuato il pagamento della 2\u00b0 rata\n\nPer importi inferiori a 12,00 \u20ac non sar\u00e0 disponibile nei [[Servizi Online](https://aunicalogin.polimi.it/aunicalogin/getservizio.xml?id_servizio=376)](https://aunicalogin.polimi.it/aunicalogin/getservizio.xml?id_servizio=376) il bollettino di pagamento, l\u2019importo dovuto sar\u00e0 automaticamente addebitato negli eventuali pagamenti successivi"], "answer": "La maggiorazione per il ritardo nel pagamento delle tasse varia a seconda delle scadenze stabilite dall'universit\u00e0. Per conoscere l'importo esatto della maggiorazione per la tua rata scaduta, ti consiglio di consultare il sito ufficiale di POLIMI nella sezione relativa alle tasse e alle procedure amministrative. L\u00ec troverai tutte le informazioni necessarie, compreso l'importo della maggiorazione e le modalit\u00e0 di pagamento.", "evaluation": {"faithfulness": 0.6666666666666667, "answer_relevancy": 0.7791462431576939, "context_recall": 0.5, "answer_similarity": 1.0, "context_precision": 0.07407407407407407, "ragas_score": 0.2592896197443079}}, {"question": "Ho redditi e patrimoni all'estero come presento l'Iseeu?", "ground_truths": ["Devi rivolgerti al CAF convenzionato per ottenere l'Iseeu-parificato entro le scadenze previste."], "contexts": ["Studenti con reddito e patrimoni dichiarati e/o posseduti solo all'estero o all'estero e in Italia\n\nAnno accademico 2023/2024\n\nSe possiedi un reddito o un patrimonio all\u2019estero (*) devi richiedere un documento, denominato\u00a0ISEEU parificato, per il calcolo delle tasse universitarie. La richiesta dell'ISEEU parificato va inviata ai Centri di Assistenza Fiscale (CAF): saranno poi questi a trasmettere il documento al Politecnico. Non dovrai presentare nulla in Segreteria, e nemmeno registrare il dato attraverso i Servizi Online.\n\n(*) reddito e/o patrimonio (immobiliare e mobiliare), tuo e/o del tuo nucleo familiare, dichiarati e/o posseduti all'estero o all'estero e in Italia\n\nAttenzione: l'ISEEU parificato non consente di richiedere l'esonero parziale o totale\u00a0([Legge 232/2016 e successive modifiche](https://www.polimi.it/studenti-iscritti/tasse-borse-e-agevolazioni-economiche/contribuzione-studentesca/esoneri-previsti-dalla-legge-di-bilancio-2017))", "Qui di seguito sono illustrate le procedure per richiedere l'ISEEU parificato.\n\n1. Prepara i documenti da allegare alla domanda\n\nDocumenti necessari per il calcolo dell'ISEEU\n\ncomposizione del nucleo familiare estero (al momento della presentazione della domanda)\n\nreddito del secondo anno precedente alla richiesta\u00a0di ciascun componente della famiglia (se uno o pi\u00f9 componenti di et\u00e0 uguale o maggiore di 18 anni non hanno percepito redditi, \u00e8 necessario presentare una dichiarazione in tal senso)\n\ndocumento relativo ai fabbricati e terreni di propriet\u00e0 della famiglia alla data del 31 dicembre del secondo anno precedente alla richiesta, con indicazione dei metri quadrati, rilasciato dall'autorit\u00e0 pubblica in materia (se non risultasse alcun fabbricato, va prodotto un certificato che attesta l'assenza di propriet\u00e0 di fabbricati per ogni membro del nucleo familiare che abbia et\u00e0 maggiore o uguale a 18 anni)\n\npatrimonio mobiliare posseduto alla data del 31 dicembre del secondo anno precedente alla richiesta dalla famiglia, con indicazione di titoli, dividendi, partecipazioni azionari, frazioni di patrimonio netto di eventuali aziende possedute)\n\nNota: deve essere dichiarata anche la presenza e consistenza di eventuali redditi e patrimonio posseduti in Italia. Si evidenzia inoltre che in assenza del requisito del reddito minimo percepito in Italia o all\u2019estero dallo studente e previsto dalla normativa ISEE per essere considerato indipendente, si dovr\u00e0 fare riferimento al proprio nucleo familiare di origine; in tal caso se i redditi e i patrimoni dello stesso sono all\u2019estero lo studente deve presentare l\u2019indicatore ISEEU PARIFICATO.", "Studenti dei campus di Cremona, Lecco, Mantova e Piacenza gi\u00e0 in Italia\n\nSe si trovano gi\u00e0 in Italia e non possono prendere un appuntamento presso le sedi di Milano, gli studenti dei campus di Cremona, Lecco, Mantova e Piacenza - seguendo le indicazioni della fase 1 e 2 (vedi sopra) - possono inviare la documentazione accedendo al [portale Digita](http://www.digitacgil.it/), indicando nella sezione\u00a0\u201cAllegati\u201d\u00a0e nel campo messaggi la propria sede campus. Verranno in seguito ricontattati dal CAF e invitati a consegnare i documenti originali in una delle sedi di Milano o nelle sedi di Cremona (via Mantova 25), di Lecco (via Besonda Inferiore 11) e di Mantova (via Argentina Altobelli, 5).\n\nGli studenti con reddito e patrimonio (immobiliare e mobiliare) proprio e/o del proprio nucleo familiare dichiarati e/o posseduti all'estero o all'estero ed in Italia,\u00a0iscritti al primo anno di Laurea e Laurea Magistrale (compresi gli studenti che si iscriveranno a partire dal secondo semestre) che hanno ottenuto l\u2019assegnazione della borsa per il diritto allo studio A.A. 2023/2024 e che intendono chiedere la graduazione del contributo onnicomprensivo, che rappresenta una parte delle tasse universitarie, devono rivolgersi al CAF indicato per ottenere l\u2019indicatore ISEEU PARIFICATO. L\u2019ISEEU PARIFICATO verr\u00e0 trasmesso dal CAF al Politecnico di Milano.\n\nL'ISEEU PARIFICATO ai fini dell'emissione della 2\u00b0 rata non \u00e8 preso in considerazione per i seguenti studenti:\n\nGli studenti internazionali (appartenenti al contingente riservato Extra UE, cio\u00e8 non equiparati agli studenti italiani) ammessi ai corsi di Laurea Magistrale\u00a0con titolo di primo livello conseguito all\u2019estero che sono assegnatari di\u00a0una borsa di studio del Politecnico di Milano o di altri enti (ad esempio borsisti del governo italiano), diversa da quella assegnata per merito e reddito del diritto allo studio, che\u00a0sono esonerati dal pagamento delle tasse e contributi, ad esclusione della quota relativa alla Tassa regionale e delle spese amministrative delle imposte di bollo"], "answer": "Se possiedi redditi e patrimoni all'estero, devi richiedere un documento chiamato ISEEU parificato per il calcolo delle tasse universitarie. La richiesta dell'ISEEU parificato deve essere inviata ai Centri di Assistenza Fiscale (CAF), che trasmetteranno il documento al Politecnico di Milano. Non \u00e8 necessario presentare nulla in Segreteria o registrare i dati tramite i Servizi Online. Per ulteriori informazioni sulle procedure per richiedere l'ISEEU parificato, puoi consultare il seguente [link](https://www.polimi.it/studenti-iscritti/tasse-borse-e-agevolazioni-economiche/contribuzione-studentesca/studenti-con-reddito-e-patrimonio-allestero).", "evaluation": {"faithfulness": 1.0, "answer_relevancy": 0.8519970314685387, "context_recall": 0.0, "answer_similarity": 1.0, "context_precision": 0.13043478260869565, "ragas_score": 0.0}}, {"question": "Dove mi rivolgo per richiedere la Dichiarazione sostitutiva unica (DSU) e calcolo Isee?", "ground_truths": ["La Dichiarazione sostitutiva unica (DSU) pu\u00f2 essere presentata:\n\nalle sedi Inps competenti per territorio\n\nai centri di assistenza fiscale (CAF)\n\nai comuni"], "contexts": ["Cosa devi fare\n\nRecati presso un CAF o accedi autonomamente all'INPS per richiedere l'ISEE corrente\n\nInserisci nei [Servizi Online](https://aunicalogin.polimi.it/aunicalogin/getservizio.xml?id_servizio=376) la data di sottoscrizione della Dichiarazione Sostitutiva Unica che hai presentato per ottenere l\u2019ISEE corrente\n\nSe per l\u2019anno accademico corrente hai gi\u00e0 inserito nei [Servizi Online](https://aunicalogin.polimi.it/aunicalogin/getservizio.xml?id_servizio=376) un\u2019altra DSU in base alla quale ti \u00e8 gi\u00e0 stata assegnata una fascia di reddito, prima di procedere alla nuova registrazione contatta la [Segreteria Studenti](https://www.polimi.it/studenti-iscritti/sportelli-e-uffici-aperti-agli-studenti)\n\nUlteriori informazioni\n\nL\u2019INPS mette a disposizione sul proprio sito una serie di informazioni utili:\n\n[La riforma dell\u2019ISEE](https://servizi2.inps.it/servizi/Iseeriforma/Home.aspx)\n\n[Prestazioni welfare legati all\u2019ISEE](https://www.inps.it/NuovoportaleINPS/default.aspx?sPathID=%3B0%3B49407%3B&lastMenu=49407&iMenu=1&sURL=%2FdocallegatiNP%2FMig%2FAllegati%2F525tabella_ISEE_2015_prestazioni_welfare.pdf&RedirectForzato=True)\n\n[Isee corrente](https://www.inps.it/it/it/inps-comunica/notizie/dettaglio-news-page.news.2021.09.isee-corrente-aggiornamento-redditi-e-patrimoni-nella-dsu.html)\n\nStudenti con redditi e patrimoni dichiarati e/o posseduti solo all'estero o all'estero e in Italia\n\nSe hai redditi e patrimoni all\u2019estero, o all'estero e in Italia, non \u00e8 possibile richiedere la certificazione ISEE. In questo caso, per ottenere agevolazioni sui contributi studenteschi, devi procurati un ISEEU parificato che \u00e8 rilasciato dal CAF convenzionato con il Politecnico di Milano.\n\nNota: con questo indicatore non \u00e8 possibile richiedere l'[esonero sulla base della Legge 232/2016](https://www.polimi.it/studenti-iscritti/tasse-borse-e-agevolazioni-economiche/contribuzione-studentesca/esoneri-previsti-dalla-legge-di-bilancio-2017)\u00a0e successive modifiche e integrazioni.", "Qui di seguito sono illustrate le procedure per richiedere l'ISEEU parificato.\n\n1. Prepara i documenti da allegare alla domanda\n\nDocumenti necessari per il calcolo dell'ISEEU\n\ncomposizione del nucleo familiare estero (al momento della presentazione della domanda)\n\nreddito del secondo anno precedente alla richiesta\u00a0di ciascun componente della famiglia (se uno o pi\u00f9 componenti di et\u00e0 uguale o maggiore di 18 anni non hanno percepito redditi, \u00e8 necessario presentare una dichiarazione in tal senso)\n\ndocumento relativo ai fabbricati e terreni di propriet\u00e0 della famiglia alla data del 31 dicembre del secondo anno precedente alla richiesta, con indicazione dei metri quadrati, rilasciato dall'autorit\u00e0 pubblica in materia (se non risultasse alcun fabbricato, va prodotto un certificato che attesta l'assenza di propriet\u00e0 di fabbricati per ogni membro del nucleo familiare che abbia et\u00e0 maggiore o uguale a 18 anni)\n\npatrimonio mobiliare posseduto alla data del 31 dicembre del secondo anno precedente alla richiesta dalla famiglia, con indicazione di titoli, dividendi, partecipazioni azionari, frazioni di patrimonio netto di eventuali aziende possedute)\n\nNota: deve essere dichiarata anche la presenza e consistenza di eventuali redditi e patrimonio posseduti in Italia. Si evidenzia inoltre che in assenza del requisito del reddito minimo percepito in Italia o all\u2019estero dallo studente e previsto dalla normativa ISEE per essere considerato indipendente, si dovr\u00e0 fare riferimento al proprio nucleo familiare di origine; in tal caso se i redditi e i patrimoni dello stesso sono all\u2019estero lo studente deve presentare l\u2019indicatore ISEEU PARIFICATO.", "Presentare l'ISEE rilasciato con data 2024\n\nLa presentazione dell'ISEE rilasciato con data 2024 \u00e8 necessaria per richiedere l'eventuale esonero e la graduazione del contributo onnicomprensivo.\n\nProcedura: accedere ai [Servizi Online](https://aunicalogin.polimi.it/aunicalogin/getservizio.xml?id_servizio=376) (Dati > Tasse e agevolazioni economiche > Dichiarazione ISEE) e inserire la data di sottoscrizione della Dichiarazione Sostitutiva Unica (vale a dire il documento che lo studente ha presentato all'INPS per chiedere il calcolo dell'ISEE). Sar\u00e0 cura del Politecnico di Milano ottenere dall'INPS la verifica della correttezza ed il valore dell'ISEE.\n\nNote:\n\nNon sono validi ISEE \"uso Universit\u00e0\" in riferimento al Codice fiscale dello studente con relativa Dichiarazione Sostitutiva Unica non riferite all'anno 2024, cio\u00e8 presentate prima del 1 gennaio 2024.\n\nPer le seguenti categorie di studenti non \u00e8 richiesta la presentazione dell\u2019ISEE con data 2024, ai fini della determinazione dell'importo di seconda rata: 1) studenti idonei/beneficiari di borsa del Diritto allo Studio, iscritti ad anni successivi al primo anno di corso (Laurea, Laurea Magistrale, Laurea Magistrale a ciclo unico); 2) studenti internazionali extra-UE, cio\u00e8 non equiparati agli studenti italiani con titolo di primo livello conseguito all\u2019estero, iscritti ai corsi di Laurea Magistrale e non idonei/beneficiari di borsa del Diritto allo Studio; 3) studenti beneficiari di borsa di studio del Governo italiano."], "answer": "Per richiedere la Dichiarazione Sostitutiva Unica (DSU) e calcolare l'ISEE, puoi rivolgerti a un CAF (Centro di Assistenza Fiscale) o accedere autonomamente al sito dell'INPS (Istituto Nazionale della Previdenza Sociale). \n\nSe preferisci recarti presso un CAF, puoi trovare quello pi\u00f9 vicino a te consultando il sito dell'INPS. Una volta presso il CAF, potrai richiedere l'assistenza per compilare la DSU e calcolare l'ISEE.\n\nSe invece preferisci accedere autonomamente al sito dell'INPS, potrai trovare tutte le informazioni necessarie per compilare la DSU e calcolare l'ISEE. Ti consiglio di consultare il sito dell'INPS per avere tutte le indicazioni dettagliate e i documenti necessari per la richiesta.\n\nRicorda che per ottenere agevolazioni sui contributi studenteschi, potrebbe essere necessario richiedere un ISEEU parificato se hai redditi e patrimoni all'estero o all'estero e in Italia. Per ulteriori informazioni su questa procedura, ti consiglio di consultare il sito del Politecnico di Milano.", "evaluation": {"faithfulness": 0.5714285714285714, "answer_relevancy": 0.872617674442067, "context_recall": 0.6666666666666666, "answer_similarity": 1.0, "context_precision": 0.15625, "ragas_score": 0.4238733167604678}}, {"question": "Sono previsti esoneri totali o parziali dal pagamento delle tasse?", "ground_truths": ["Si, sono previsti esoneri per merito, studenti lavoratori, genitori studenti Erasmus doppia Laurea etc.\n\nTi ricordiamo che per ottenere gli esoneri \u00e8 necessario presentare la domanda dal 15 gennaio 2024 al 25 marzo 2024."], "contexts": ["Studenti al 1\u00b0 anno di iscrizione\n\nTipo di esonero\n\nRequisiti richiesti\n\nEsonero totale\n\nISEE da 0 \u20ac a 22.000 \u20ac\n\nEsonero parziale\n\nISEE da 22.001 a 30.000 \u20ac\n\nStudenti al 2\u00b0 anno di iscrizione\n\nTipo di esonero\n\nRequisiti richiesti\n\nEsonero totale\n\nISEE da 0 \u20ac a 22.000 \u20acMinimo 10 CFU (*)\n\nEsonero parziale\n\nISEE da 22.001 a 30.000 \u20ac Minimo 10 CFU (*)\n\n(*) conseguiti entro il 10 agosto del 1\u00b0 anno\n\nStudenti iscritti ad anni successivi al 2\u00b0\n\nTipo di esonero\n\nRequisiti richiesti\n\nEsonero totale\n\nISEE da 0 \u20ac a 22.000 \u20ac Minimo 25 CFU (*) Regolarit\u00e0 iscrizione (**)\n\nEsonero parziale\n\nISEE da 22.001 a 30.000 \u20ac Minimo 25 CFU (*)Regolarit\u00e0 iscrizione (**)\n\nEsonero parziale ridotto\n\nISEE da 0 a 30.000 \u20acMinimo 25 CFU (*)\n\n(*) conseguiti nei 12 mesi antecedenti il 10 agosto che precede la relativa iscrizione\n\n(**)\u00a0essere iscritti a un Corso di Studi da un numero di anni accademici inferiore o uguale alla durata normale del Corso di Studi aumentata di uno (Corsi di Laurea = 3+1, Corsi di Laurea Magistrale = 2+1; Corso di Laurea Magistrale a ciclo unico = 5+1)", "Esoneri previsti dalla legge di bilancio 2017 (e successive modifiche e integrazioni)\n\nAnno accademico 2023/2024\n\nLa Legge di Bilancio 2017 (L. 232/2016), e successive modifiche e integrazioni, prevede che gli studenti che rispettano determinate condizioni siano esonerati totalmente o parzialmente dal pagamento del contributo onnicomprensivo. Il diritto all\u2019esonero dipende da una serie di requisiti che variano a seconda dell\u2019anno di iscrizione dello studente.\n\nNota: con l\u2019indicatore [ISEEU PARIFICATO](https://www.polimi.it/studenti-iscritti/tasse-borse-e-agevolazioni-economiche/contribuzione-studentesca/studenti-con-reddito-e-patrimonio-allestero) non \u00e8 possibile richiedere l'esonero sulla base della Legge 232/2016 e successive modifiche e integrazioni.\n\n1. Requisiti richiesti", "5 - Esonero totale dal contributo onnicomprensivo previsto dall\u2019art.30 legge 118/1971\n\nStudenti che appartengono a famiglie di disagiata condizione economica (Isee \u2264 22.000 \u20ac):\n\nmutilati e invalidi civili con diminuzione della capacit\u00e0 lavorativa superiore ai due terzi\n\nfigli di beneficiari della pensione di inabilit\u00e0\n\norfani di guerra, mutilati e invalidi di guerra, ciechi civili, mutilati e invalidi di lavoro, di servizio e i loro figli\n\nLa richiesta va presentata attraverso i canali della [Segreteria Studenti](https://www.polimi.it/studenti-iscritti/sportelli-e-uffici-aperti-agli-studenti) entro la scadenza della prima rata o il conseguimento del titolo.\n\n6 - Ulteriori esoneri\n\nSul contributo onnicomprensivo (ricalcolato sulla base delle agevolazioni previste nei punti precedenti) sono previste altre possibilit\u00e0 di esonero che permettono di ridurre ulteriormente l'importo finale."], "answer": "S\u00ec, sono previsti esoneri totali o parziali dal pagamento delle tasse per gli studenti di POLIMI. Gli esoneri dipendono da diversi fattori, come l'anno di iscrizione dello studente e il suo ISEE (Indicatore della Situazione Economica Equivalente). \n\nPer gli studenti al primo anno di iscrizione, sono previsti esoneri totali per coloro che hanno un ISEE da 0 \u20ac a 22.000 \u20ac e esoneri parziali per coloro che hanno un ISEE da 22.001 \u20ac a 30.000 \u20ac.\n\nPer gli studenti al secondo anno di iscrizione, gli esoneri totali sono previsti per coloro che hanno un ISEE da 0 \u20ac a 22.000 \u20ac e hanno conseguito almeno 10 CFU entro il 10 agosto del primo anno. Gli esoneri parziali sono previsti per coloro che hanno un ISEE da 22.001 \u20ac a 30.000 \u20ac e hanno conseguito almeno 10 CFU entro il 10 agosto del primo anno.\n\nPer gli studenti iscritti ad anni successivi al secondo, gli esoneri totali sono previsti per coloro che hanno un ISEE da 0 \u20ac a 22.000 \u20ac, hanno conseguito almeno 25 CFU nei 12 mesi precedenti il 10 agosto che precede l'iscrizione e hanno regolarit\u00e0 di iscrizione. Gli esoneri parziali sono previsti per coloro che hanno un ISEE da 22.001 \u20ac a 30.000 \u20ac, hanno conseguito almeno 25 CFU nei 12 mesi precedenti il 10 agosto che precede l'iscrizione e hanno regolarit\u00e0 di iscrizione. \u00c8 inoltre previsto un esonero parziale ridotto per coloro che hanno un ISEE da 0 \u20ac a 30.000 \u20ac e hanno conseguito almeno 25 CFU.\n\n\u00c8 importante notare che questi requisiti possono variare, quindi ti consiglio di consultare il sito ufficiale di POLIMI per ulteriori informazioni sui requisiti specifici per gli esoneri dalle tasse. Puoi trovare ulteriori dettagli sui [requisiti e gli esoneri previsti dalla legge di bilancio 2017](https://www.polimi.it/studenti-iscritti/tasse-borse-e-agevolazioni-economiche/contribuzione-studentesca/esoneri-previsti-dalla-legge-di-bilancio-2017).", "evaluation": {"faithfulness": 1.0, "answer_relevancy": 0.8827008988576613, "context_recall": 0.0, "answer_similarity": 0.0, "context_precision": 0.05, "ragas_score": 0.0}}, {"question": "Come avviene il rimborso?", "ground_truths": ["Il rimborso \u00e8 in automatico con accredito sul conto corrente a te intestato/cointestato registrato sui Servizi Online > Dati > Gestione delle modalit\u00e0 di pagamento > Aggiungi o modifica modalit\u00e0 di pagamento standard. Ad accertamento avvenuto del rimborso riceverai apposita comunicazione (e-mail) con le relative indicazioni."], "contexts": ["Le Segreterie Amministrative del Politecnico di Milano non forniscono ulteriori informazioni inerenti alla dichiarazione dei redditi. Per informazioni pi\u00f9 dettagliate rivolgiti all'Agenzia delle Entrate o all'intermediario che si occupa delle relative dichiarazioni dei redditi.\n\nRimborsi rinunciatari nuove matricole\n\nCon la presentazione della domanda di rinuncia agli studi entro le\u00a0[scadenze previste](https://scadenziario.polimi.it/index.php?id=5&L=0&argomento=5), le\u00a0nuove matricole avranno il rimborso della 1\u00b0 rata di tasse.\n\nLo studente \u00e8 tenuto ad indicare le modalit\u00e0 di pagamento che desidera per eventuali rimborsi accedendo ai [Servizi Online](https://aunicalogin.polimi.it/aunicalogin/getservizio.xml?id_servizio=376) > Dati > Gestione delle modalit\u00e0 di pagamento e aggiornare eventuali modifiche. In mancanza di tali indicazioni non sar\u00e0 possibile procedere all'accredito dell'importo spettante.\n\nIl rimborsonon include l'imposta di bollo di 16 \u20ac e le assicurazioni (totale 9.59 \u20ac) e\u00a0non \u00e8 erogabile nel caso in cui siano stati richiesti certificati di iscrizione in bollo e siano stati utilizzati.\n\nAttenzione: Il conto corrente deve essere intestato/cointestato allo studente.\n\n[Per ulteriori informazioni](https://www.polimi.it/studenti-iscritti/interruzione-sospensione-rinuncia-decadenza/rinuncia-agli-studi)", "Come pagare le rate\n\ndalla tua pagina personale: \"Tasse universitarie\" > \"Ultima richiesta non pagata\", accedi alla piattaforma PagoPA, selezionando \u201cPaga tramite PagoPA \u201c- PAGA ON LINE:\u00a0scegli, tra i metodi di pagamento proposti, \"Altri metodi di pagamento\", optando tra le opzioni proposte in base alla verifica dei limiti delle stesse, o \"Addebito in conto\" (se la tua banca offre il servizio MyBank)\n\ndalla tua pagina personale: \"Tasse universitarie\" > \"Ultima richiesta non pagata\", seleziona \"Paga tramite PagoPA\" - PAGA PI\u00d9 TARDI:\u00a0seleziona \"Modulo di pagamento.pdf\" e con l'avviso di pagamento potrai effettuare l'operazione allo sportello della tua banca, o attraverso Home Banking con PagoPA o circuito CBILL utilizzando il codice interbancario: F9489, oppure presso sportelli ATM abilitati\n\ndalla tua pagina personale: \"Tasse universitarie\" > \"Ultima richiesta non pagata\", seleziona \"Paga tramite PagoPA\", scegli come metodo di pagamento [SCRIGNO PAGO FACILE](https://www.popso.it/app)\n\nAttenzione: si consiglia di verificare che le tempistiche legate alle diverse modalit\u00e0 di pagamento non comportino il superamento delle date di scadenza. Dopo avere pagato non \u00e8 necessario presentare in Segreteria alcun documento. Potrai controllare la registrazione dell\u2019avvenuto pagamento sui Servizi Online > Dati > Tasse e agevolazioni economiche > Storico pagamenti.", "Detrazioni e rimborsi\n\nAnno accademico 2023/2024\n\nDetrazione delle spese per la formazione universitaria\n\nLe spese per l\u2019istruzione e la formazione universitaria sono considerate oneri per i quali \u00e8 riconosciuta una detrazione d\u2019imposta del 19%.\n\nPer i pagamenti effettuati tramite PagoPA \u00e8 possibile scaricare dai [Servizi OnLine](https://aunicalogin.polimi.it/aunicalogin/getservizio.xml?id_servizio=376) (alla voce \"Tasse e agevolazioni economiche\", selezionando \"Storico pagamenti\") la \"ricevuta telematica\".\n\nOppure in alternativa puoi scaricare dai Servizi Online una \"Quietanza\" eventualmente soggetta a bollo:\n\nper importi inferiori a 77,47 \u20ac puoi salvare copia dell'attestazione cliccando su \"Salva Quietanza\"\n\nper importi superiori a 77,47 \u20ac \u00e8 necessario prima pagare un'imposta di bollo di 2 \u20ac. Utilizza la funzionalit\u00e0 \"Paga bollo per Quietanza\" che consente di accedere alla piattaforma PagoPA per effettuare il pagamento. Solo quando il pagamento del bollo risulter\u00e0 contabilizzato, sar\u00e0 resa disponibile la funzionalit\u00e0 \"Salva Quietanza\"\n\nSi informa che i dati relativi alle tasse pagate vengono comunicati all\u2019[Agenzia delle Entrate](https://www.agenziaentrate.gov.it/portale/schede/comunicazioni/opposizioni-utilizzo-delle-spese/opposizione-utilizzo-delle-spese-universitarie/informazioni-generali-opposizione-utilizzo-delle-spese-universitarie) al fine del loro inserimento nel 730 precompilato. Le spese universitarie che sono comunicate riguardano il totale delle spese sostenute nell'anno civile per iscrizione, tasse e contributi universitari al netto dei rimborsi relativi alle spese sostenute nello stesso anno civile.\n\nGli studenti che volessero opporsi (vedi [Agenzia delle Entrate](https://www.agenziaentrate.gov.it/portale/schede/comunicazioni/opposizioni-utilizzo-delle-spese/opposizione-utilizzo-delle-spese-universitarie/informazioni-generali-opposizione-utilizzo-delle-spese-universitarie)) all\u2019inserimento di tali dati nella dichiarazione precompilata possono comunicarlo nel periodo previsto dall\u2019[Agenzia delle Entrate](https://www.agenziaentrate.gov.it/portale/schede/comunicazioni/opposizioni-utilizzo-delle-spese/opposizione-utilizzo-delle-spese-universitarie/informazioni-generali-opposizione-utilizzo-delle-spese-universitarie) seguendo le indicazioni fornite dalla stessa."], "answer": "Il rimborso delle tasse avviene nel caso in cui uno studente presenti una domanda di rinuncia agli studi entro le scadenze previste. Le nuove matricole possono ottenere il rimborso della prima rata di tasse. Lo studente deve indicare le modalit\u00e0 di pagamento desiderate per il rimborso accedendo ai Servizi Online e aggiornando eventuali modifiche. \u00c8 importante notare che il rimborso non include l'imposta di bollo e le assicurazioni e non \u00e8 erogabile nel caso in cui siano stati richiesti certificati di iscrizione in bollo e siano stati utilizzati. Per ulteriori informazioni, puoi consultare il seguente link: [Rimborsi rinunciatari nuove matricole](https://www.polimi.it/studenti-iscritti/interruzione-sospensione-rinuncia-decadenza/rinuncia-agli-studi)", "evaluation": {"faithfulness": 1.0, "answer_relevancy": 0.8920112371578376, "context_recall": 0.0, "answer_similarity": 1.0, "context_precision": 0.2413793103448276, "ragas_score": 0.0}}, {"question": "Posso ottenere un rimborso per l'esame di lingua inglese?", "ground_truths": ["Si \u00e8 previsto il rimborso di \u20ac 100,00 se hai ottenuto un punteggio utile per l'accesso alle lauree magistrali, per un solo esame superato durante il percorso di studi triennale presso il Politecnico di MIlano.\n\nIl rimborso viene erogato in automatico non devi presentare nessuna richiesta.\n\nVisita la pagina: Agevolazioni economiche previste"], "contexts": ["2. Studenti che presentano certificazione linguistica\n\nSe sei uno studente dei corsi di Laurea del Politecnico e devi sostenere il test di lingua inglese, l\u2019Ateneo ti riconosce un rimborso forfettario pari a 100,00 \u20ac a copertura delle spese richieste.\n\n[Per ulteriori informazioni](https://www.polimi.it/studenti-iscritti/requisiti-lingue-inglese-e-italiano/agevolazioni-economiche-previste)\n\nINDIRIZZO", "\u00c8 inoltre previsto l'esonero totale dal contributo onnicomprensivo per studenti stranieri beneficiari di borsa di studio annuale del Governo italiano: contattare [international-scholarships@polimi.it](mailto:international-scholarships@polimi.it)\n\n7 - Agevolazioni per studenti prossimi alla conclusione degli studi\n\nSono infine previste agevolazioni per gli studenti prossimi alla conclusione degli studi e per gli studenti dei Corsi di Laurea che presentano una certificazione linguistica idonea a proseguire gli studi alla Laurea Magistrale.\n\nMaggiori informazioni\n\nAltre informazioni\n\nScadenze e procedure amministrative\n\nCos'\u00e8 l'ISEE\n\nInformazioni sulle tasse per corsi singoli e integrazioni curriculari\n\nDetrazioni e Rimborsi\n\nCategorie particolari di studenti\n\nStudenti con reddito e patrimonio all'estero\n\nStudenti del corso di Ingegneria Informatica Online\n\nRifugiati politici", "Tale agevolazione non sar\u00e0 attribuita in caso di presentazione di un Piano degli Studi per l\u2019ulteriore anno accademico che preveda l\u2019inserimento di insegnamenti in soprannumero.\n\nGli studenti iscritti ad un corso di laurea di ordinamenti antecedenti al DM 509/ 1999 possono usufruire della medesima agevolazione se devono sostenere non pi\u00f9 di tre esami.\u00a0 La registrazione dell\u2019attestazione Isee 2024, come sopra indicato, dovr\u00e0 avvenire almeno 10 giorni prima dell\u2019iscrizione all\u2019appello di laurea; per l\u2019Iseeu parificato 2024 si dovr\u00e0 inviare la\u00a0documentazione necessaria e richiedere esplicitamente al CAF la trasmissione della pratica al Politecnico prima dell\u2019iscrizione all\u2019appello di laurea.\n\nIn assenza di Isee 2024 all\u2019atto dell\u2019iscrizione all\u2019appello di laurea sar\u00e0 considerato, se registrato, l\u2019Isee 2023.\n\nNel caso in cui gli studenti di cui sopra non si laureino entro i termini indicati, il contributo onnicomprensivo annuo, dovuto in base al numero CFU e Isee 2024, sar\u00e0 pari al 100%; l\u2019eventuale conguaglio verr\u00e0 richiesto con la 2\u00b0 rata.\n\nB) se si laureano in appelli successivi all'ultima sessione di laurea dell'anno accademico precedente (da luglio 2024 e successivi appelli), hanno un Piano degli Studi completo per l\u2019anno accademico precedente (2022/2023) ed hanno sostenuto tutti gli esami di profitto, compresi gli eventuali insegnamenti in posizione di soprannumero e le righe di piano di tipo tirocinio, negli appelli dell\u2019anno accademico precedente, l\u2019importo del contributo onnicomprensivo sar\u00e0 pari al 25% dell'importo dovuto.\u00a0In questo caso, se si tratta di studenti iscritti al corso di laurea Informatica Online,\u00a0saranno esonerati anche dal contributo spese per l\u2019utilizzo della relativa piattaforma."], "answer": "S\u00ec, se sei uno studente dei corsi di Laurea del Politecnico di Milano e devi sostenere il test di lingua inglese, l'Ateneo ti riconosce un rimborso forfettario pari a 100,00 \u20ac a copertura delle spese richieste. Per ulteriori informazioni su questa agevolazione, puoi consultare il seguente [link](https://www.polimi.it/studenti-iscritti/requisiti-lingue-inglese-e-italiano/agevolazioni-economiche-previste).", "evaluation": {"faithfulness": 1.0, "answer_relevancy": 0.8630260845550448, "context_recall": 0.6666666666666666, "answer_similarity": 1.0, "context_precision": 0.08333333333333333, "ragas_score": 0.3001432248243279}}, {"question": "Mi serve la ricevuta di pagamento delle tasse universitarie, come posso ottenerla?", "ground_truths": ["Attraverso i Servizi Online alla voce Tasse e Agevolazioni economiche e poi nel men\u00f9 Storico Pagamenti. \nEffettuando il pagamento della relativa marca da bollo da 2 euro, potrai stampare la quietanza relativa ad importi superiori a 77.74 \u20ac, per gli importi inferiori invece stampa direttamente il file."], "contexts": ["Come pagare le rate\n\ndalla tua pagina personale: \"Tasse universitarie\" > \"Ultima richiesta non pagata\", accedi alla piattaforma PagoPA, selezionando \u201cPaga tramite PagoPA \u201c- PAGA ON LINE:\u00a0scegli, tra i metodi di pagamento proposti, \"Altri metodi di pagamento\", optando tra le opzioni proposte in base alla verifica dei limiti delle stesse, o \"Addebito in conto\" (se la tua banca offre il servizio MyBank)\n\ndalla tua pagina personale: \"Tasse universitarie\" > \"Ultima richiesta non pagata\", seleziona \"Paga tramite PagoPA\" - PAGA PI\u00d9 TARDI:\u00a0seleziona \"Modulo di pagamento.pdf\" e con l'avviso di pagamento potrai effettuare l'operazione allo sportello della tua banca, o attraverso Home Banking con PagoPA o circuito CBILL utilizzando il codice interbancario: F9489, oppure presso sportelli ATM abilitati\n\ndalla tua pagina personale: \"Tasse universitarie\" > \"Ultima richiesta non pagata\", seleziona \"Paga tramite PagoPA\", scegli come metodo di pagamento [SCRIGNO PAGO FACILE](https://www.popso.it/app)\n\nAttenzione: si consiglia di verificare che le tempistiche legate alle diverse modalit\u00e0 di pagamento non comportino il superamento delle date di scadenza. Dopo avere pagato non \u00e8 necessario presentare in Segreteria alcun documento. Potrai controllare la registrazione dell\u2019avvenuto pagamento sui Servizi Online > Dati > Tasse e agevolazioni economiche > Storico pagamenti.", "Pagare la 1\u00b0 e la 2\u00b0 rata delle tasse\n\nTramite sistema [PagoPA](https://www.pagopa.gov.it/):\n\nattraverso i [[Servizi Online](https://aunicalogin.polimi.it/aunicalogin/getservizio.xml?id_servizio=376)](https://aunicalogin.polimi.it/aunicalogin/getservizio.xml?id_servizio=376)\n\ncon l'apposito modulo di pagamento nei [[Servizi Online](https://aunicalogin.polimi.it/aunicalogin/getservizio.xml?id_servizio=376)](https://aunicalogin.polimi.it/aunicalogin/getservizio.xml?id_servizio=376)\u00a0> Tasse e agevolazioni economiche > Ultima richiesta non pagata, utilizzabile presso i punti di pagamento convenzionati con il sistema [PagoPA](https://www.pagopa.gov.it/) (tutti i principali istituti di credito, tranne gli uffici di Poste Italiane)\n\nattraverso il sistema [PagoFacile](https://pagofacile.popso.it/)\u00a0nelle modalit\u00e0 di pagamento: \t-IUV utilizzando il Codice Avviso di Pagamento sulla stampa dell\u2019avviso \toppure \t-utilizzando il circuito CBILL con il codice interbancario: F9489\n\ntramite Poste Italiane - [Paga online](https://www.poste.it/paga-online.html), utilizzando il bollettino postale integrato negli avvisi di pagamento [PagoPA](https://www.pagopa.gov.it/)\n\nNote:\n\nIl pagamento della 2\u00b0 rata comporta l\u2019accettazione della fascia di contribuzione attribuita; non sar\u00e0 quindi possibile richiedere eventuali variazioni in diminuzione della fascia dopo aver effettuato il pagamento della 2\u00b0 rata\n\nPer importi inferiori a 12,00 \u20ac non sar\u00e0 disponibile nei [[Servizi Online](https://aunicalogin.polimi.it/aunicalogin/getservizio.xml?id_servizio=376)](https://aunicalogin.polimi.it/aunicalogin/getservizio.xml?id_servizio=376) il bollettino di pagamento, l\u2019importo dovuto sar\u00e0 automaticamente addebitato negli eventuali pagamenti successivi", "La scadenza per il pagamento della prima rata delle tasse dell'anno accademico 2023/2024 \u00e8 il 13 settembre 2023, fatta eccezione per gli studenti indicati qui di seguito.\n\nQUALI STUDENTI POSSONO PAGARE LA PRIMA RATA DELLE TASSE OLTRE LA SCADENZA DEL 13 SETTEMBRE 2023 SENZA INCORRERE NELLA MAGGIORAZIONE PER IL RITARDO?\n\nStudenti di Laurea (triennale)\n\nChi ha necessit\u00e0 di presentare un piano degli studi per l'anno accademico 2023/2024\u00a0\"identico\" (senza alcuna modifica) a quello dell'anno 2022/2023\u00a0al solo fine di poter sostenere esami del primo semestre a marzo 2024\n\nChi non riesce a laurearsi nella sessione di marzo 2024\n\nStudenti di Laurea Magistrale (biennale)\n\nChi ha la necessit\u00e0 di sostenere solo esami del primo semestre per i quali \u00e8 richiesta l\u2019iscrizione al nuovo anno accademico\n\nChi non riesce a laurearsi nella sessione di aprile 2024\n\nSolo per questi studenti la scadenza da rispettare per non incorrere nella maggiorazione \u00e8 il giorno 22 marzo 2024.\n\nAlcune operazioni amministrative potrebbero richiedere il pagamento della prima rata per poter procedere, ad esempio, all\u2019iscrizione (per gli studenti con un piano completo) agli appelli d\u2019esame dell'anno accademico 2023/2024 o alla registrazione in carriera dell'esito di un esame svolto in una sessione dell'anno accademico 2023/2024. Tali operazioni prevedono che sia stata pagata la rata di iscrizione, pertanto lo studente che si trova in una di queste situazioni dovr\u00e0 essere in regola con tutti i pagamenti."], "answer": "Per ottenere la ricevuta di pagamento delle tasse universitarie, puoi seguire questi passaggi:\n\n1. Accedi alla tua pagina personale dei Servizi Online di POLIMI.\n2. Seleziona la sezione \"Tasse universitarie\".\n3. Cerca l'ultima richiesta di pagamento non pagata e seleziona l'opzione \"Paga tramite PagoPA\".\n4. Scegli il metodo di pagamento desiderato tra quelli disponibili, come ad esempio il pagamento online o l'addebito in conto.\n5. Completa il pagamento seguendo le istruzioni fornite dal sistema PagoPA.\n6. Dopo aver effettuato il pagamento, potrai controllare la registrazione dell'avvenuto pagamento nella sezione \"Storico pagamenti\" dei Servizi Online.\n\nRicorda che non \u00e8 necessario presentare alcun documento in segreteria dopo aver effettuato il pagamento. La ricevuta di pagamento sar\u00e0 disponibile direttamente nella sezione \"Storico pagamenti\" dei Servizi Online.\n\nPer ulteriori informazioni e dettagli sulle procedure di pagamento delle tasse universitarie, puoi consultare il seguente [link](https://www.polimi.it/studenti-iscritti/tasse-borse-e-agevolazioni-economiche/contribuzione-studentesca/scadenze-e-procedure-amministrative).", "evaluation": {"faithfulness": 0.8181818181818181, "answer_relevancy": 0.9796512242614727, "context_recall": 0.5, "answer_similarity": 1.0, "context_precision": 0.7407407407407407, "ragas_score": 0.7583808280592437}}, {"question": "Sono uno studente prossimo alla laurea, devo pagare le tasse?", "ground_truths": ["Per capire se devi pagare la rata d'iscrizione devi consultare la sezione:\nStudenti prossimi alla conclusione degli studi"], "contexts": ["Quanto si paga in un anno accademico\n\nPrima e seconda rata\n\nDetrazione spese universitarie\n\nRimborso delle tasse (a seguito di rinuncia agli studi)\n\nQuanto si paga in un anno accademico\n\nL\u2019importo delle tasse universitarie \u00e8 variabile in funzione del piano degli studi che presenterai e dalla condizione economica, determinata dall\u2019[ISEE](https://www.polimi.it/studenti-iscritti/tasse-borse-e-agevolazioni-economiche/contribuzione-studentesca/cose-lisee)\u00a0(Indicatore della Situazione Economica Equivalente).\u00a0Le rate sono due e vanno pagate ciascuna in un\u2019unica soluzione.\n\nCon un [piano degli studi standard](https://www.polimi.it/studenti-iscritti/piano-degli-studi-e-ofa-di-inglese-e-italiano/cose-il-piano-degli-studi)\u00a0tra i 46 e i 74 CFU (Credti Formativi Universitari) e un [ISEE](https://www.polimi.it/studenti-iscritti/tasse-borse-e-agevolazioni-economiche/contribuzione-studentesca/cose-lisee) fino a \u20ac 22.000, l\u2019importo \u00e8 di \u20ac 165.59; per Isee di valori superiori, l\u2019importo aumenta gradualmente fino ad un massimo di \u20ac 3.891,59. In particolare, per [ISEE](https://www.polimi.it/studenti-iscritti/tasse-borse-e-agevolazioni-economiche/contribuzione-studentesca/cose-lisee) compresi tra i \u20ac 22.001 e \u20ac 30.000 l\u2019importo \u00e8 calcolato con una [specifica formula](https://www.polimi.it/studenti-iscritti/tasse-borse-e-agevolazioni-economiche/contribuzione-studentesca/esoneri-previsti-dalla-legge-di-bilancio-2017); per [ISEE](https://www.polimi.it/studenti-iscritti/tasse-borse-e-agevolazioni-economiche/contribuzione-studentesca/cose-lisee) superiori a \u20ac 30.000, l\u2019importo \u00e8 definito in base alle [fasce di contribuzione](https://www.polimi.it/studenti-iscritti/tasse-borse-e-agevolazioni-economiche/contribuzione-studentesca/graduazione-del-contributo-onnicomprensivo). A questi importi viene poi applicata la [percentuale corrispondente al numero di CFU](https://www.polimi.it/studenti-iscritti/tasse-borse-e-agevolazioni-economiche/contribuzione-studentesca/commisurazione-dellimporto-onnicomprensivo-sulla-base-dei-cfu) del piano studi.\n\nN.B. Gli\u00a0studenti internazionali (appartenenti al contingente riservato extra UE, cio\u00e8 non equiparati agli studenti italiani), ammessi ai corsi di laurea magistrale con titolo di primo livello conseguito all\u2019estero che non sono assegnatari di una borsa di studio del Politecnico di Milano o di altri enti, o di borsa assegnata per merito e reddito del Diritto allo Studio, sono tenuti al pagamento dell\u2019importo massimo rapportato alla [percentuale corrispondente al numero di CFU](https://www.polimi.it/studenti-iscritti/tasse-borse-e-agevolazioni-economiche/contribuzione-studentesca/commisurazione-dellimporto-onnicomprensivo-sulla-base-dei-cfu) del piano degli studi.", "La scadenza per il pagamento della prima rata delle tasse dell'anno accademico 2023/2024 \u00e8 il 13 settembre 2023, fatta eccezione per gli studenti indicati qui di seguito.\n\nQUALI STUDENTI POSSONO PAGARE LA PRIMA RATA DELLE TASSE OLTRE LA SCADENZA DEL 13 SETTEMBRE 2023 SENZA INCORRERE NELLA MAGGIORAZIONE PER IL RITARDO?\n\nStudenti di Laurea (triennale)\n\nChi ha necessit\u00e0 di presentare un piano degli studi per l'anno accademico 2023/2024\u00a0\"identico\" (senza alcuna modifica) a quello dell'anno 2022/2023\u00a0al solo fine di poter sostenere esami del primo semestre a marzo 2024\n\nChi non riesce a laurearsi nella sessione di marzo 2024\n\nStudenti di Laurea Magistrale (biennale)\n\nChi ha la necessit\u00e0 di sostenere solo esami del primo semestre per i quali \u00e8 richiesta l\u2019iscrizione al nuovo anno accademico\n\nChi non riesce a laurearsi nella sessione di aprile 2024\n\nSolo per questi studenti la scadenza da rispettare per non incorrere nella maggiorazione \u00e8 il giorno 22 marzo 2024.\n\nAlcune operazioni amministrative potrebbero richiedere il pagamento della prima rata per poter procedere, ad esempio, all\u2019iscrizione (per gli studenti con un piano completo) agli appelli d\u2019esame dell'anno accademico 2023/2024 o alla registrazione in carriera dell'esito di un esame svolto in una sessione dell'anno accademico 2023/2024. Tali operazioni prevedono che sia stata pagata la rata di iscrizione, pertanto lo studente che si trova in una di queste situazioni dovr\u00e0 essere in regola con tutti i pagamenti.", "Attenzione: per le agevolazioni sopra descritte, sar\u00e0 attribuito il solo beneficio economico pi\u00f9 vantaggioso per lo studente, in caso di contemporanea assegnazione delle [categorie previste come ulteriori esoneri](https://www.polimi.it/studenti-iscritti/tasse-borse-e-agevolazioni-economiche/contribuzione-studentesca/altre-possibilita-di-esonero-previste-dal-politecnico).\n\nCHI SONO GLI STUDENTI CHE NON DEVONO PRENDERE ISCRIZIONE ALL'A.A. 2023/2024 (CIO\u00c8 NON DEVONO PAGARE LA PRIMA RATA 2023/2024)?\n\nStudenti di Laurea (triennale):\n\nChi si laurea nella sessione di settembre 2023\n\nChi si laurea nella sessione di marzo 2024 e deve sostenere solo esami del secondo semestre 2022/2023 (senza dover presentare un Piano degli Studi per l\u2019anno accademico 2023/2024)\n\nStudenti di Laurea Magistrale (biennale):\n\nChi si laurea nella sessione di ottobre o in quella di dicembre 2023 (senza avere fatto un Piano degli Studi per l'anno accademico 2023/2024)\n\nChi si laurea nella sessione di aprile 2024 e deve sostenere solo esami del secondo semestre 2022/2023\u00a0(senza avere fatto un Piano degli Studi per l'anno accademico 2023/2024)\n\nCHI SONO GLI STUDENTI CHE DEVONO PAGARE LA PRIMA RATA DELLE TASSE DELL'A.A. 2023/2024?\n\nChi presenta domanda di concorso per i benefici del Diritto allo Studio anno accademico 2023/2024\n\nChi si laurea entro la sessione di marzo 2024 (per la Laurea Triennale) o aprile\u00a02024\u00a0(per la Laurea Magistrale) e ha avuto la necessit\u00e0 presentare un piano degli studi dell'anno accademico 2023/2024 e/o deve sostenere esami del primo semestre e/o ha la necessit\u00e0 di richiedere una certificazione relativa all\u2019iscrizione all\u2019anno accademico 2023/2024\n\nQUANDO DEVO PAGARE LA PRIMA RATA DELLE TASSE DELL'A.A. 2023/2024 SENZA INCORRERE NELLA MAGGIORAZIONE PER IL RITARDO?"], "answer": "Per conoscere l'importo delle tasse che devi pagare per l'anno accademico corrente, ti consiglio di consultare il sito ufficiale del Politecnico di Milano. L'importo delle tasse varia in base al piano di studi e alla tua situazione economica, determinata dall'ISEE (Indicatore della Situazione Economica Equivalente). Puoi trovare tutte le informazioni dettagliate sulle tasse universitarie e sulle modalit\u00e0 di pagamento sul sito ufficiale del Politecnico di Milano. (fonte: <a href=\"https://www.polimi.it/futuri-studenti/tasse/lauree-e-lauree-magistrali\">Politecnico di Milano - Tasse</a>)", "evaluation": {"faithfulness": 0.5, "answer_relevancy": 0.8312846071200157, "context_recall": 0.0, "answer_similarity": 1.0, "context_precision": 0.08823529411764706, "ragas_score": 0.0}}, {"question": "Ho richiesto per sbaglio lo IUV del pagamento della prima rata, cosa devo fare?", "ground_truths": ["Se non devi o vuoi iscriverti all'anno accademico non pagare lo IUV.\nLa generazione dello IUV non comporta l'obbligo del pagamento e non \u00e8 possibile eliminare lo IUV generato."], "contexts": ["Attenzione: l'emissione del bollettino di pagamento di seconda rata avverr\u00e0 indipendentemente dalla richiesta di assegnazione di una fascia inferiore al contributo pieno. Il pagamento in ritardo della rata comporter\u00e0 l\u2019attribuzione di un\u2019ulteriore maggiorazione dovuta in relazione al ritardo nel pagamento. In caso di registrazione in ritardo della sottoscrizione ISEE 2024, nei Servizi Online occorrer\u00e0 comunicare espressamente alla Segreteria studenti la necessit\u00e0 di generare un bollettino di pagamento aggiornato.\n\nIn mancanza di un ISEE valido e in ogni caso dopo il pagamento della seconda rata, non \u00e8 concessa nessuna riduzione del contributo onnicomprensivo pieno.\n\nMaggiori informazioni sull'ISEE\n\nL\u2019indicatore ISEE \u00e8 rilasciato dall\u2019INPS e puoi rivolgerti ad un CAF per avere assistenza e supporto. Puoi trovare tutte le informazioni necessarie ed un simulatore per il calcolo sul sito dell'INPS> Prestazioni e servizi > Tutti i servizi > [ISEE Post-riforma 2015](https://servizi2.inps.it/servizi/iseeriforma/home.aspx). L\u2019ISEE deve essere rilasciato \"uso Universit\u00e0\" in riferimento al codice fiscale dello studente e non deve contenere \u201comissioni/difformit\u00e0/discordanze\u201d. Gli studenti sono obbligati a dichiarare tutti i redditi, il patrimonio mobiliare e immobiliare previsti dalla normativa ISEE e sono responsabili della completezza e della conformit\u00e0 alla normativa citata della propria dichiarazione ISEE.\n\n[Maggiori informazioni](https://www.polimi.it/studenti-iscritti/tasse-borse-e-agevolazioni-economiche/contribuzione-studentesca/cose-lisee)", "La scadenza per il pagamento della prima rata delle tasse dell'anno accademico 2023/2024 \u00e8 il 13 settembre 2023, fatta eccezione per gli studenti indicati qui di seguito.\n\nQUALI STUDENTI POSSONO PAGARE LA PRIMA RATA DELLE TASSE OLTRE LA SCADENZA DEL 13 SETTEMBRE 2023 SENZA INCORRERE NELLA MAGGIORAZIONE PER IL RITARDO?\n\nStudenti di Laurea (triennale)\n\nChi ha necessit\u00e0 di presentare un piano degli studi per l'anno accademico 2023/2024\u00a0\"identico\" (senza alcuna modifica) a quello dell'anno 2022/2023\u00a0al solo fine di poter sostenere esami del primo semestre a marzo 2024\n\nChi non riesce a laurearsi nella sessione di marzo 2024\n\nStudenti di Laurea Magistrale (biennale)\n\nChi ha la necessit\u00e0 di sostenere solo esami del primo semestre per i quali \u00e8 richiesta l\u2019iscrizione al nuovo anno accademico\n\nChi non riesce a laurearsi nella sessione di aprile 2024\n\nSolo per questi studenti la scadenza da rispettare per non incorrere nella maggiorazione \u00e8 il giorno 22 marzo 2024.\n\nAlcune operazioni amministrative potrebbero richiedere il pagamento della prima rata per poter procedere, ad esempio, all\u2019iscrizione (per gli studenti con un piano completo) agli appelli d\u2019esame dell'anno accademico 2023/2024 o alla registrazione in carriera dell'esito di un esame svolto in una sessione dell'anno accademico 2023/2024. Tali operazioni prevedono che sia stata pagata la rata di iscrizione, pertanto lo studente che si trova in una di queste situazioni dovr\u00e0 essere in regola con tutti i pagamenti.", "Per ottenere una riduzione dell\u2019importo massimo della seconda rata devi:\n\nrichiedere, a partire da gennaio, un nuovo calcolo dell\u2019ISEE per uso universitario all\u2019INPS o a un CAF; se hai redditi o patrimoni all\u2019estero o all\u2019estero e in Italia, devi richiedere il calcolo [dell\u2019ISEEU parificato](https://www.polimi.it/studenti-iscritti/tasse-borse-e-agevolazioni-economiche/contribuzione-studentesca/studenti-con-reddito-e-patrimonio-allestero) secondo le procedure descritte nella pagina dedicata\n\nin attesa di ricevere l\u2019ISEE, devi inserire nei [Servizi Online](https://aunicalogin.polimi.it/aunicalogin/getservizio.xml?id_servizio=376)\u00a0[Dati >Tasse e agevolazioni economiche > Dichiarazione ISEE], la data della sottoscrizione della Dichiarazione Sostitutiva Unica\n\nAttenzione: l\u2019importo massimo \u00e8 richiesto in automatico agli studenti che non presentano un ISEE e agli studenti internazionali (appartenenti al contingente riservato Extra UE, cio\u00e8 non equiparati agli studenti italiani), iscritti ai corsi di Laurea Magistrale\u00a0con titolo di primo livello conseguito all\u2019estero\u00a0e non\u00a0assegnatari di una Borsa di studio del Politecnico di Milano o di altri Enti, anche se presentano ISEEU parificato.\n\nLa seconda rata con il relativo importo sar\u00e0 disponibile nei [Servizi Online](https://aunicalogin.polimi.it/aunicalogin/getservizio.xml?id_servizio=376), indicativamente un mese prima rispetto alla [scadenza](https://scadenziario.polimi.it/index.php?id=5&L=0) per il pagamento, da effettuare, entro i termini previsti, accedendo ai [Servizi Online](https://aunicalogin.polimi.it/aunicalogin/getservizio.xml?id_servizio=376) (Dati >Tasse e agevolazioni economiche > selezionando \"Ultima richiesta non pagata\").\n\nSe vuoi approfondire la questione delle rate, visita la [sezione dedicata alla contribuzione studentesca](https://www.polimi.it/studenti-iscritti/tasse-borse-e-agevolazioni-economiche/contribuzione-studentesca/studenti-con-reddito-e-patrimonio-allestero)."], "answer": "Se hai richiesto per errore lo IUV del pagamento della prima rata, ti consiglio di contattare il servizio di segreteria studenti di POLIMI. Possono fornirti assistenza e indicarti la procedura corretta da seguire per risolvere il problema. Puoi trovare i contatti della segreteria studenti sul sito ufficiale di POLIMI.", "evaluation": {"faithfulness": 0.33333333333333337, "answer_relevancy": 0.8758052831790887, "context_recall": 0.0, "answer_similarity": 0.0, "context_precision": 0.07407407407407407, "ragas_score": 0.0}}, {"ground_truths": "Dataset evaluation", "evaluation": {"faithfulness": 0.6665084915084916, "answer_relevancy": 0.8756435150791693, "context_recall": 0.2717948717948718, "answer_similarity": 0.8461538461538461, "context_precision": 0.1916200027005908, "ragas_score": 0.39301692075352135}}]