[
    {
        "question": "Vorrei delle informazioni riguardo l'ammontare della rata annuale per frequentare il Politecnico.",
        "ground_truths": [
            "Il contributo onnicomprensivo è indicato nella sezione Contribuzione studentesca.\nL'importo dei soli contributi della seconda rata è determinato in relazione alla fascia di contribuzione assegnata e dal numero di crediti formativi (CFU) che hai inserito nel Piano degli studi."
        ],
        "contexts": [
            "Quanto si paga in un anno accademico\n\nPrima e seconda rata\n\nDetrazione spese universitarie\n\nRimborso delle tasse (a seguito di rinuncia agli studi)\n\nQuanto si paga in un anno accademico\n\nL’importo delle tasse universitarie è variabile in funzione del piano degli studi che presenterai e dalla condizione economica, determinata dall’[ISEE](https://www.polimi.it/studenti-iscritti/tasse-borse-e-agevolazioni-economiche/contribuzione-studentesca/cose-lisee) (Indicatore della Situazione Economica Equivalente). Le rate sono due e vanno pagate ciascuna in un’unica soluzione.\n\nCon un [piano degli studi standard](https://www.polimi.it/studenti-iscritti/piano-degli-studi-e-ofa-di-inglese-e-italiano/cose-il-piano-degli-studi) tra i 46 e i 74 CFU (Credti Formativi Universitari) e un [ISEE](https://www.polimi.it/studenti-iscritti/tasse-borse-e-agevolazioni-economiche/contribuzione-studentesca/cose-lisee) fino a € 22.000, l’importo è di € 165.59; per Isee di valori superiori, l’importo aumenta gradualmente fino ad un massimo di € 3.891,59. In particolare, per [ISEE](https://www.polimi.it/studenti-iscritti/tasse-borse-e-agevolazioni-economiche/contribuzione-studentesca/cose-lisee) compresi tra i € 22.001 e € 30.000 l’importo è calcolato con una [specifica formula](https://www.polimi.it/studenti-iscritti/tasse-borse-e-agevolazioni-economiche/contribuzione-studentesca/esoneri-previsti-dalla-legge-di-bilancio-2017); per [ISEE](https://www.polimi.it/studenti-iscritti/tasse-borse-e-agevolazioni-economiche/contribuzione-studentesca/cose-lisee) superiori a € 30.000, l’importo è definito in base alle [fasce di contribuzione](https://www.polimi.it/studenti-iscritti/tasse-borse-e-agevolazioni-economiche/contribuzione-studentesca/graduazione-del-contributo-onnicomprensivo). A questi importi viene poi applicata la [percentuale corrispondente al numero di CFU](https://www.polimi.it/studenti-iscritti/tasse-borse-e-agevolazioni-economiche/contribuzione-studentesca/commisurazione-dellimporto-onnicomprensivo-sulla-base-dei-cfu) del piano studi.\n\nN.B. Gli studenti internazionali (appartenenti al contingente riservato extra UE, cioè non equiparati agli studenti italiani), ammessi ai corsi di laurea magistrale con titolo di primo livello conseguito all’estero che non sono assegnatari di una borsa di studio del Politecnico di Milano o di altri enti, o di borsa assegnata per merito e reddito del Diritto allo Studio, sono tenuti al pagamento dell’importo massimo rapportato alla [percentuale corrispondente al numero di CFU](https://www.polimi.it/studenti-iscritti/tasse-borse-e-agevolazioni-economiche/contribuzione-studentesca/commisurazione-dellimporto-onnicomprensivo-sulla-base-dei-cfu) del piano degli studi.",
            "Gli studenti particolarmente capaci e meritevoli che si trovano in una determinata condizione economica, possono accedere anche ai benefici per il [Diritto allo Studio](https://www.polimi.it/studenti-iscritti/tasse-borse-e-agevolazioni-economiche/il-diritto-allo-studio-universitario-dsu).\n\nSe intendi iscriverti alla Laurea Online (IOL), segui le indicazioni riportate dal [sito del corso](http://www.laureaonline.polimi.it/tempi-e-costi/).\n\nPrima e seconda rata\n\nLa prima rata, per tutti i corsi di studio (laurea, laurea magistrale, ciclo unico), è pari a € 888,59 e viene versata all’atto dell’immatricolazione. Tuttavia, è prevista una riduzione di questo importo per ISEE con valore inferiore a € 27.740 e per ottenerla devi:\n\nrichiedere il [calcolo dell’ISEE per uso universitario](https://www.polimi.it/studenti-iscritti/tasse-borse-e-agevolazioni-economiche/contribuzione-studentesca/cose-lisee) direttamente dal sito dell’[INPS](https://www.inps.it/) (accedendo all'apposito servizio, che prevede anche la modalità precompilata dell'ISEE) oppure tramite un CAF (Centro Assistenza Fiscale)\n\ninserire nei [Servizi Online](https://aunicalogin.polimi.it/aunicalogin/getservizio.xml?id_servizio=376) [Richieste di ammissione > Inserimento Isee per immatricolazione], almeno 10 giorni lavorativi prima dell’immatricolazione, la data della sottoscrizione della Dichiarazione Sostitutiva Unica (è la data in cui hai firmato quel documento che hai presentato all’[INPS](https://www.inps.it/), direttamente o tramite CAF, per ottenere il calcolo dell’ISEE)\n\nLa seconda rata generalmente si paga a maggio, in base alle disposizioni definite ogni anno, indicate sullo [scadenzario](https://scadenziario.polimi.it/index.php?id=5&L=0&argomento=18) e viene calcolata tenendo conto di:\n\nnumero di crediti (CFU) contenuti nel piano degli studi\n\nfascia di reddito di appartenenza corrispondente all’ISEE o, per chi ha redditi e patrimoni all’estero, all’estero e in Italia, [dall’ISEEU-parificato](https://www.polimi.it/studenti-iscritti/tasse-borse-e-agevolazioni-economiche/contribuzione-studentesca/studenti-con-reddito-e-patrimonio-allestero)\n\nL’importo della seconda rata varia da un minimo di € 0 a un massimo di € 3.003 (per un piano degli studi standard).",
            "Attenzione:\n\nper informazioni sulle tasse per i corsi singoli visita la [sezione Futuri studenti](https://www.polimi.it/futuri-studenti/ammissione-ai-corsi-singoli)\n\nper gli studenti iscritti alla Laurea Online (IOL): l’iscrizione alla Laurea in informatica OnLine prevede, oltre al pagamento della quota ordinaria (variabile in base al proprio reddito e al numero di crediti annuali previsti dal piano di studi), una quota fissa aggiuntiva di 1500 € annui per l’accesso ai servizi online. Pertanto la prima rata per gli studenti che si iscriveranno al corso di laurea IOL sarà pari a 1888,59 €. Consulta il sito [http://www.laureaonline.polimi.it/tempi-e-costi/](http://www.laureaonline.polimi.it/tempi-e-costi/)\n\nStudenti dipendenti della Pubblica Amministrazione\n\nPer gli studenti dipendenti della Pubblica Amministrazione che esprimono la volontà di iscriversi aderendo al pagamento del contributo onnicomprensivo agevolato, l’importo dovuto sarà pari a 1.000 €, oltre al pagamento della tassa regionale, imposta di bollo e assicurazioni. L’importo è fisso e non dipendente da altri elementi della carriera (% CFU, graduazione del contributo onnicomprensivo, esonero sulla base della Legge 232/2016 e successive modifiche e integrazioni, ulteriori esoneri e particolari agevolazioni ecc.).\n\nSe iscritti alla Laurea in informatica OnLine (IOL), al contributo onnicomprensivo agevolato, sarà dovuto anche l’importo di 1.000 € per l’utilizzo della piattaforma e servizio di tutorato dedicato. L’adesione al contributo onnicomprensivo agevolato è rinnovata automaticamente per gli anni accademici successivi, salvo espressa richiesta di revoca da parte dell’interessato."
        ],
        "answer": "L'importo delle tasse universitarie al Politecnico di Milano varia in base al piano di studi e alla condizione economica dello studente, determinata dall'ISEE (Indicatore della Situazione Economica Equivalente). Le tasse vengono pagate in due rate, ciascuna in un'unica soluzione.\n\nPer un piano di studi standard tra i 46 e i 74 CFU e un ISEE fino a € 22.000, l'importo è di € 165.59. Per ISEE di valori superiori, l'importo aumenta gradualmente fino ad un massimo di € 3.891,59. Per ISEE compresi tra i € 22.001 e € 30.000, l'importo è calcolato con una specifica formula. Per ISEE superiori a € 30.000, l'importo è definito in base alle fasce di contribuzione. A questi importi viene poi applicata la percentuale corrispondente al numero di CFU del piano di studi.\n\nGli studenti internazionali (non equiparati agli studenti italiani) ammessi ai corsi di laurea magistrale con titolo di primo livello conseguito all'estero sono tenuti al pagamento dell'importo massimo rapportato alla percentuale corrispondente al numero di CFU del piano di studi.\n\nPer maggiori informazioni sulle tasse universitarie al Politecnico di Milano, puoi consultare il [sito ufficiale](https://www.polimi.it/futuri-studenti/tasse/lauree-e-lauree-magistrali)."
    },
    {
        "question": "Come pagare le rate ?",
        "ground_truths": [
            "Dai Servizi Online Dati -Tasse e agevolazioni economiche - seleziona \"Ultima richiesta non pagata\", accedi alla piattaforma PagoPA e scegli tra i metodi di pagamento che ti verranno proposti."
        ],
        "contexts": [
            "Come pagare le rate\n\ndalla tua pagina personale: \"Tasse universitarie\" > \"Ultima richiesta non pagata\", accedi alla piattaforma PagoPA, selezionando “Paga tramite PagoPA “- PAGA ON LINE: scegli, tra i metodi di pagamento proposti, \"Altri metodi di pagamento\", optando tra le opzioni proposte in base alla verifica dei limiti delle stesse, o \"Addebito in conto\" (se la tua banca offre il servizio MyBank)\n\ndalla tua pagina personale: \"Tasse universitarie\" > \"Ultima richiesta non pagata\", seleziona \"Paga tramite PagoPA\" - PAGA PIÙ TARDI: seleziona \"Modulo di pagamento.pdf\" e con l'avviso di pagamento potrai effettuare l'operazione allo sportello della tua banca, o attraverso Home Banking con PagoPA o circuito CBILL utilizzando il codice interbancario: F9489, oppure presso sportelli ATM abilitati\n\ndalla tua pagina personale: \"Tasse universitarie\" > \"Ultima richiesta non pagata\", seleziona \"Paga tramite PagoPA\", scegli come metodo di pagamento [SCRIGNO PAGO FACILE](https://www.popso.it/app)\n\nAttenzione: si consiglia di verificare che le tempistiche legate alle diverse modalità di pagamento non comportino il superamento delle date di scadenza. Dopo avere pagato non è necessario presentare in Segreteria alcun documento. Potrai controllare la registrazione dell’avvenuto pagamento sui Servizi Online > Dati > Tasse e agevolazioni economiche > Storico pagamenti.",
            "Pagare la 1° e la 2° rata delle tasse\n\nTramite sistema [PagoPA](https://www.pagopa.gov.it/):\n\nattraverso i [[Servizi Online](https://aunicalogin.polimi.it/aunicalogin/getservizio.xml?id_servizio=376)](https://aunicalogin.polimi.it/aunicalogin/getservizio.xml?id_servizio=376)\n\ncon l'apposito modulo di pagamento nei [[Servizi Online](https://aunicalogin.polimi.it/aunicalogin/getservizio.xml?id_servizio=376)](https://aunicalogin.polimi.it/aunicalogin/getservizio.xml?id_servizio=376) > Tasse e agevolazioni economiche > Ultima richiesta non pagata, utilizzabile presso i punti di pagamento convenzionati con il sistema [PagoPA](https://www.pagopa.gov.it/) (tutti i principali istituti di credito, tranne gli uffici di Poste Italiane)\n\nattraverso il sistema [PagoFacile](https://pagofacile.popso.it/) nelle modalità di pagamento: \t-IUV utilizzando il Codice Avviso di Pagamento sulla stampa dell’avviso \toppure \t-utilizzando il circuito CBILL con il codice interbancario: F9489\n\ntramite Poste Italiane - [Paga online](https://www.poste.it/paga-online.html), utilizzando il bollettino postale integrato negli avvisi di pagamento [PagoPA](https://www.pagopa.gov.it/)\n\nNote:\n\nIl pagamento della 2° rata comporta l’accettazione della fascia di contribuzione attribuita; non sarà quindi possibile richiedere eventuali variazioni in diminuzione della fascia dopo aver effettuato il pagamento della 2° rata\n\nPer importi inferiori a 12,00 € non sarà disponibile nei [[Servizi Online](https://aunicalogin.polimi.it/aunicalogin/getservizio.xml?id_servizio=376)](https://aunicalogin.polimi.it/aunicalogin/getservizio.xml?id_servizio=376) il bollettino di pagamento, l’importo dovuto sarà automaticamente addebitato negli eventuali pagamenti successivi",
            "La scadenza per il pagamento della prima rata delle tasse dell'anno accademico 2023/2024 è il 13 settembre 2023, fatta eccezione per gli studenti indicati qui di seguito.\n\nQUALI STUDENTI POSSONO PAGARE LA PRIMA RATA DELLE TASSE OLTRE LA SCADENZA DEL 13 SETTEMBRE 2023 SENZA INCORRERE NELLA MAGGIORAZIONE PER IL RITARDO?\n\nStudenti di Laurea (triennale)\n\nChi ha necessità di presentare un piano degli studi per l'anno accademico 2023/2024 \"identico\" (senza alcuna modifica) a quello dell'anno 2022/2023 al solo fine di poter sostenere esami del primo semestre a marzo 2024\n\nChi non riesce a laurearsi nella sessione di marzo 2024\n\nStudenti di Laurea Magistrale (biennale)\n\nChi ha la necessità di sostenere solo esami del primo semestre per i quali è richiesta l’iscrizione al nuovo anno accademico\n\nChi non riesce a laurearsi nella sessione di aprile 2024\n\nSolo per questi studenti la scadenza da rispettare per non incorrere nella maggiorazione è il giorno 22 marzo 2024.\n\nAlcune operazioni amministrative potrebbero richiedere il pagamento della prima rata per poter procedere, ad esempio, all’iscrizione (per gli studenti con un piano completo) agli appelli d’esame dell'anno accademico 2023/2024 o alla registrazione in carriera dell'esito di un esame svolto in una sessione dell'anno accademico 2023/2024. Tali operazioni prevedono che sia stata pagata la rata di iscrizione, pertanto lo studente che si trova in una di queste situazioni dovrà essere in regola con tutti i pagamenti."
        ],
        "answer": "Per pagare le rate delle tasse universitarie, puoi seguire le seguenti procedure:\n\n1. Accedi alla tua pagina personale sui [Servizi Online](https://aunicalogin.polimi.it/aunicalogin/getservizio.xml?id_servizio=376).\n2. Seleziona la sezione \"Tasse universitarie\" e poi \"Ultima richiesta non pagata\".\n3. Da qui, avrai diverse opzioni per effettuare il pagamento:\n\n   - Paga online tramite PagoPA: seleziona \"Paga tramite PagoPA\" e segui le istruzioni per il pagamento online. Potrai scegliere tra diversi metodi di pagamento, come addebito in conto o altri metodi di pagamento disponibili.\n   - Paga più tardi: seleziona \"Modulo di pagamento.pdf\" e potrai effettuare il pagamento allo sportello della tua banca o tramite Home Banking con PagoPA o circuito CBILL utilizzando il codice interbancario F9489.\n   - Paga tramite Scrigno Pago Facile: seleziona \"Paga tramite PagoPA\" e scegli come metodo di pagamento [Scrigno Pago Facile](https://www.popso.it/app).\n\nSi consiglia di verificare le tempistiche legate alle diverse modalità di pagamento per evitare il superamento delle date di scadenza. Dopo aver effettuato il pagamento, non è necessario presentare alcun documento in Segreteria. Potrai controllare la registrazione dell'avvenuto pagamento sui Servizi Online nella sezione \"Dati\" > \"Tasse e agevolazioni economiche\" > \"Storico pagamenti\". Per ulteriori informazioni, puoi consultare la pagina dedicata sul sito del Politecnico di Milano [qui](https://www.polimi.it/studenti-iscritti/tasse-borse-e-agevolazioni-economiche/contribuzione-studentesca/scadenze-e-procedure-amministrative)."
    },
    {
        "question": "Per pagare la 1° e la 2° rata posso utilizzare scrigno Pago Facile della Banca Popolare di Sondrio?",
        "ground_truths": [
            "Si, per farlo devi accedere al sito Pago Facile\n\nNelle modalità di pagamento:\n\n- IUV utilizzando il Codice Avviso di Pagamento sulla stampa dell’avviso\noppure\n- utilizzando il circuito CBILL con il codice interbancario: F9489"
        ],
        "contexts": [
            "Pagare la 1° e la 2° rata delle tasse\n\nTramite sistema [PagoPA](https://www.pagopa.gov.it/):\n\nattraverso i [[Servizi Online](https://aunicalogin.polimi.it/aunicalogin/getservizio.xml?id_servizio=376)](https://aunicalogin.polimi.it/aunicalogin/getservizio.xml?id_servizio=376)\n\ncon l'apposito modulo di pagamento nei [[Servizi Online](https://aunicalogin.polimi.it/aunicalogin/getservizio.xml?id_servizio=376)](https://aunicalogin.polimi.it/aunicalogin/getservizio.xml?id_servizio=376) > Tasse e agevolazioni economiche > Ultima richiesta non pagata, utilizzabile presso i punti di pagamento convenzionati con il sistema [PagoPA](https://www.pagopa.gov.it/) (tutti i principali istituti di credito, tranne gli uffici di Poste Italiane)\n\nattraverso il sistema [PagoFacile](https://pagofacile.popso.it/) nelle modalità di pagamento: \t-IUV utilizzando il Codice Avviso di Pagamento sulla stampa dell’avviso \toppure \t-utilizzando il circuito CBILL con il codice interbancario: F9489\n\ntramite Poste Italiane - [Paga online](https://www.poste.it/paga-online.html), utilizzando il bollettino postale integrato negli avvisi di pagamento [PagoPA](https://www.pagopa.gov.it/)\n\nNote:\n\nIl pagamento della 2° rata comporta l’accettazione della fascia di contribuzione attribuita; non sarà quindi possibile richiedere eventuali variazioni in diminuzione della fascia dopo aver effettuato il pagamento della 2° rata\n\nPer importi inferiori a 12,00 € non sarà disponibile nei [[Servizi Online](https://aunicalogin.polimi.it/aunicalogin/getservizio.xml?id_servizio=376)](https://aunicalogin.polimi.it/aunicalogin/getservizio.xml?id_servizio=376) il bollettino di pagamento, l’importo dovuto sarà automaticamente addebitato negli eventuali pagamenti successivi",
            "Come pagare le rate\n\ndalla tua pagina personale: \"Tasse universitarie\" > \"Ultima richiesta non pagata\", accedi alla piattaforma PagoPA, selezionando “Paga tramite PagoPA “- PAGA ON LINE: scegli, tra i metodi di pagamento proposti, \"Altri metodi di pagamento\", optando tra le opzioni proposte in base alla verifica dei limiti delle stesse, o \"Addebito in conto\" (se la tua banca offre il servizio MyBank)\n\ndalla tua pagina personale: \"Tasse universitarie\" > \"Ultima richiesta non pagata\", seleziona \"Paga tramite PagoPA\" - PAGA PIÙ TARDI: seleziona \"Modulo di pagamento.pdf\" e con l'avviso di pagamento potrai effettuare l'operazione allo sportello della tua banca, o attraverso Home Banking con PagoPA o circuito CBILL utilizzando il codice interbancario: F9489, oppure presso sportelli ATM abilitati\n\ndalla tua pagina personale: \"Tasse universitarie\" > \"Ultima richiesta non pagata\", seleziona \"Paga tramite PagoPA\", scegli come metodo di pagamento [SCRIGNO PAGO FACILE](https://www.popso.it/app)\n\nAttenzione: si consiglia di verificare che le tempistiche legate alle diverse modalità di pagamento non comportino il superamento delle date di scadenza. Dopo avere pagato non è necessario presentare in Segreteria alcun documento. Potrai controllare la registrazione dell’avvenuto pagamento sui Servizi Online > Dati > Tasse e agevolazioni economiche > Storico pagamenti.",
            "Attenzione: l'emissione del bollettino di pagamento di seconda rata avverrà indipendentemente dalla richiesta di assegnazione di una fascia inferiore al contributo pieno. Il pagamento in ritardo della rata comporterà l’attribuzione di un’ulteriore maggiorazione dovuta in relazione al ritardo nel pagamento. In caso di registrazione in ritardo della sottoscrizione ISEE 2024, nei Servizi Online occorrerà comunicare espressamente alla Segreteria studenti la necessità di generare un bollettino di pagamento aggiornato.\n\nIn mancanza di un ISEE valido e in ogni caso dopo il pagamento della seconda rata, non è concessa nessuna riduzione del contributo onnicomprensivo pieno.\n\nMaggiori informazioni sull'ISEE\n\nL’indicatore ISEE è rilasciato dall’INPS e puoi rivolgerti ad un CAF per avere assistenza e supporto. Puoi trovare tutte le informazioni necessarie ed un simulatore per il calcolo sul sito dell'INPS> Prestazioni e servizi > Tutti i servizi > [ISEE Post-riforma 2015](https://servizi2.inps.it/servizi/iseeriforma/home.aspx). L’ISEE deve essere rilasciato \"uso Università\" in riferimento al codice fiscale dello studente e non deve contenere “omissioni/difformità/discordanze”. Gli studenti sono obbligati a dichiarare tutti i redditi, il patrimonio mobiliare e immobiliare previsti dalla normativa ISEE e sono responsabili della completezza e della conformità alla normativa citata della propria dichiarazione ISEE.\n\n[Maggiori informazioni](https://www.polimi.it/studenti-iscritti/tasse-borse-e-agevolazioni-economiche/contribuzione-studentesca/cose-lisee)"
        ],
        "answer": "Sì, puoi utilizzare Scrigno Pago Facile della Banca Popolare di Sondrio per pagare la 1° e la 2° rata delle tasse universitarie. Per ulteriori informazioni sulle modalità di pagamento, ti consiglio di consultare il sito ufficiale di POLIMI al seguente link: [Pagare la 1° e la 2° rata delle tasse](https://www.polimi.it/studenti-iscritti/tasse-borse-e-agevolazioni-economiche/contribuzione-studentesca/scadenze-e-procedure-amministrative)"
    },
    {
        "question": "Se l'importo dovuto supera il plafond della mia carta di credito come posso fare?",
        "ground_truths": [
            "In alternativa puoi utilizzare la POLICARD con l’importo richiesto\nConsulta le informazioni relative a PagoPA"
        ],
        "contexts": [
            "Come pagare le rate\n\ndalla tua pagina personale: \"Tasse universitarie\" > \"Ultima richiesta non pagata\", accedi alla piattaforma PagoPA, selezionando “Paga tramite PagoPA “- PAGA ON LINE: scegli, tra i metodi di pagamento proposti, \"Altri metodi di pagamento\", optando tra le opzioni proposte in base alla verifica dei limiti delle stesse, o \"Addebito in conto\" (se la tua banca offre il servizio MyBank)\n\ndalla tua pagina personale: \"Tasse universitarie\" > \"Ultima richiesta non pagata\", seleziona \"Paga tramite PagoPA\" - PAGA PIÙ TARDI: seleziona \"Modulo di pagamento.pdf\" e con l'avviso di pagamento potrai effettuare l'operazione allo sportello della tua banca, o attraverso Home Banking con PagoPA o circuito CBILL utilizzando il codice interbancario: F9489, oppure presso sportelli ATM abilitati\n\ndalla tua pagina personale: \"Tasse universitarie\" > \"Ultima richiesta non pagata\", seleziona \"Paga tramite PagoPA\", scegli come metodo di pagamento [SCRIGNO PAGO FACILE](https://www.popso.it/app)\n\nAttenzione: si consiglia di verificare che le tempistiche legate alle diverse modalità di pagamento non comportino il superamento delle date di scadenza. Dopo avere pagato non è necessario presentare in Segreteria alcun documento. Potrai controllare la registrazione dell’avvenuto pagamento sui Servizi Online > Dati > Tasse e agevolazioni economiche > Storico pagamenti.",
            "Per ottenere una riduzione dell’importo massimo della seconda rata devi:\n\nrichiedere, a partire da gennaio, un nuovo calcolo dell’ISEE per uso universitario all’INPS o a un CAF; se hai redditi o patrimoni all’estero o all’estero e in Italia, devi richiedere il calcolo [dell’ISEEU parificato](https://www.polimi.it/studenti-iscritti/tasse-borse-e-agevolazioni-economiche/contribuzione-studentesca/studenti-con-reddito-e-patrimonio-allestero) secondo le procedure descritte nella pagina dedicata\n\nin attesa di ricevere l’ISEE, devi inserire nei [Servizi Online](https://aunicalogin.polimi.it/aunicalogin/getservizio.xml?id_servizio=376) [Dati >Tasse e agevolazioni economiche > Dichiarazione ISEE], la data della sottoscrizione della Dichiarazione Sostitutiva Unica\n\nAttenzione: l’importo massimo è richiesto in automatico agli studenti che non presentano un ISEE e agli studenti internazionali (appartenenti al contingente riservato Extra UE, cioè non equiparati agli studenti italiani), iscritti ai corsi di Laurea Magistrale con titolo di primo livello conseguito all’estero e non assegnatari di una Borsa di studio del Politecnico di Milano o di altri Enti, anche se presentano ISEEU parificato.\n\nLa seconda rata con il relativo importo sarà disponibile nei [Servizi Online](https://aunicalogin.polimi.it/aunicalogin/getservizio.xml?id_servizio=376), indicativamente un mese prima rispetto alla [scadenza](https://scadenziario.polimi.it/index.php?id=5&L=0) per il pagamento, da effettuare, entro i termini previsti, accedendo ai [Servizi Online](https://aunicalogin.polimi.it/aunicalogin/getservizio.xml?id_servizio=376) (Dati >Tasse e agevolazioni economiche > selezionando \"Ultima richiesta non pagata\").\n\nSe vuoi approfondire la questione delle rate, visita la [sezione dedicata alla contribuzione studentesca](https://www.polimi.it/studenti-iscritti/tasse-borse-e-agevolazioni-economiche/contribuzione-studentesca/studenti-con-reddito-e-patrimonio-allestero).",
            "Pagare la 1° e la 2° rata delle tasse\n\nTramite sistema [PagoPA](https://www.pagopa.gov.it/):\n\nattraverso i [[Servizi Online](https://aunicalogin.polimi.it/aunicalogin/getservizio.xml?id_servizio=376)](https://aunicalogin.polimi.it/aunicalogin/getservizio.xml?id_servizio=376)\n\ncon l'apposito modulo di pagamento nei [[Servizi Online](https://aunicalogin.polimi.it/aunicalogin/getservizio.xml?id_servizio=376)](https://aunicalogin.polimi.it/aunicalogin/getservizio.xml?id_servizio=376) > Tasse e agevolazioni economiche > Ultima richiesta non pagata, utilizzabile presso i punti di pagamento convenzionati con il sistema [PagoPA](https://www.pagopa.gov.it/) (tutti i principali istituti di credito, tranne gli uffici di Poste Italiane)\n\nattraverso il sistema [PagoFacile](https://pagofacile.popso.it/) nelle modalità di pagamento: \t-IUV utilizzando il Codice Avviso di Pagamento sulla stampa dell’avviso \toppure \t-utilizzando il circuito CBILL con il codice interbancario: F9489\n\ntramite Poste Italiane - [Paga online](https://www.poste.it/paga-online.html), utilizzando il bollettino postale integrato negli avvisi di pagamento [PagoPA](https://www.pagopa.gov.it/)\n\nNote:\n\nIl pagamento della 2° rata comporta l’accettazione della fascia di contribuzione attribuita; non sarà quindi possibile richiedere eventuali variazioni in diminuzione della fascia dopo aver effettuato il pagamento della 2° rata\n\nPer importi inferiori a 12,00 € non sarà disponibile nei [[Servizi Online](https://aunicalogin.polimi.it/aunicalogin/getservizio.xml?id_servizio=376)](https://aunicalogin.polimi.it/aunicalogin/getservizio.xml?id_servizio=376) il bollettino di pagamento, l’importo dovuto sarà automaticamente addebitato negli eventuali pagamenti successivi"
        ],
        "answer": "Se l'importo dovuto supera il plafond della tua carta di credito, ci sono diverse opzioni che puoi considerare:\n\n1. Utilizzare un'altra carta di credito con un plafond più alto, se ne possiedi una.\n\n2. Contattare la tua banca per richiedere un aumento temporaneo del plafond della tua carta di credito.\n\n3. Effettuare il pagamento utilizzando un'altra forma di pagamento, come bonifico bancario o pagamento in contanti presso uno sportello bancario. Per ulteriori informazioni su come effettuare il pagamento delle tasse, puoi consultare la pagina [Pagamento delle tasse](https://www.polimi.it/studenti-iscritti/tasse-borse-e-agevolazioni-economiche/contribuzione-studentesca/scadenze-e-procedure-amministrative).\n\nRicorda che è importante rispettare le scadenze dei pagamenti per evitare eventuali sanzioni o problemi con la tua iscrizione. Se hai ulteriori domande o dubbi, ti consiglio di contattare direttamente il servizio tasse del Politecnico di Milano."
    },
    {
        "question": "Ho dimenticato di pagare la rata quanto dovrò pagare di maggiorazione?",
        "ground_truths": [
            "L’importo della mora varia in proporzione all’entità del ritardo e può essere pari ad un valore massimo di 110,00 €, così come riportato nella sezione Maggiorazioni dovute a ritardi \nTale importo verrà addebitato sulla prima richiesta di pagamento successiva."
        ],
        "contexts": [
            "La scadenza per il pagamento della prima rata delle tasse dell'anno accademico 2023/2024 è il 13 settembre 2023, fatta eccezione per gli studenti indicati qui di seguito.\n\nQUALI STUDENTI POSSONO PAGARE LA PRIMA RATA DELLE TASSE OLTRE LA SCADENZA DEL 13 SETTEMBRE 2023 SENZA INCORRERE NELLA MAGGIORAZIONE PER IL RITARDO?\n\nStudenti di Laurea (triennale)\n\nChi ha necessità di presentare un piano degli studi per l'anno accademico 2023/2024 \"identico\" (senza alcuna modifica) a quello dell'anno 2022/2023 al solo fine di poter sostenere esami del primo semestre a marzo 2024\n\nChi non riesce a laurearsi nella sessione di marzo 2024\n\nStudenti di Laurea Magistrale (biennale)\n\nChi ha la necessità di sostenere solo esami del primo semestre per i quali è richiesta l’iscrizione al nuovo anno accademico\n\nChi non riesce a laurearsi nella sessione di aprile 2024\n\nSolo per questi studenti la scadenza da rispettare per non incorrere nella maggiorazione è il giorno 22 marzo 2024.\n\nAlcune operazioni amministrative potrebbero richiedere il pagamento della prima rata per poter procedere, ad esempio, all’iscrizione (per gli studenti con un piano completo) agli appelli d’esame dell'anno accademico 2023/2024 o alla registrazione in carriera dell'esito di un esame svolto in una sessione dell'anno accademico 2023/2024. Tali operazioni prevedono che sia stata pagata la rata di iscrizione, pertanto lo studente che si trova in una di queste situazioni dovrà essere in regola con tutti i pagamenti.",
            "Come pagare le rate\n\ndalla tua pagina personale: \"Tasse universitarie\" > \"Ultima richiesta non pagata\", accedi alla piattaforma PagoPA, selezionando “Paga tramite PagoPA “- PAGA ON LINE: scegli, tra i metodi di pagamento proposti, \"Altri metodi di pagamento\", optando tra le opzioni proposte in base alla verifica dei limiti delle stesse, o \"Addebito in conto\" (se la tua banca offre il servizio MyBank)\n\ndalla tua pagina personale: \"Tasse universitarie\" > \"Ultima richiesta non pagata\", seleziona \"Paga tramite PagoPA\" - PAGA PIÙ TARDI: seleziona \"Modulo di pagamento.pdf\" e con l'avviso di pagamento potrai effettuare l'operazione allo sportello della tua banca, o attraverso Home Banking con PagoPA o circuito CBILL utilizzando il codice interbancario: F9489, oppure presso sportelli ATM abilitati\n\ndalla tua pagina personale: \"Tasse universitarie\" > \"Ultima richiesta non pagata\", seleziona \"Paga tramite PagoPA\", scegli come metodo di pagamento [SCRIGNO PAGO FACILE](https://www.popso.it/app)\n\nAttenzione: si consiglia di verificare che le tempistiche legate alle diverse modalità di pagamento non comportino il superamento delle date di scadenza. Dopo avere pagato non è necessario presentare in Segreteria alcun documento. Potrai controllare la registrazione dell’avvenuto pagamento sui Servizi Online > Dati > Tasse e agevolazioni economiche > Storico pagamenti.",
            "Pagare la 1° e la 2° rata delle tasse\n\nTramite sistema [PagoPA](https://www.pagopa.gov.it/):\n\nattraverso i [[Servizi Online](https://aunicalogin.polimi.it/aunicalogin/getservizio.xml?id_servizio=376)](https://aunicalogin.polimi.it/aunicalogin/getservizio.xml?id_servizio=376)\n\ncon l'apposito modulo di pagamento nei [[Servizi Online](https://aunicalogin.polimi.it/aunicalogin/getservizio.xml?id_servizio=376)](https://aunicalogin.polimi.it/aunicalogin/getservizio.xml?id_servizio=376) > Tasse e agevolazioni economiche > Ultima richiesta non pagata, utilizzabile presso i punti di pagamento convenzionati con il sistema [PagoPA](https://www.pagopa.gov.it/) (tutti i principali istituti di credito, tranne gli uffici di Poste Italiane)\n\nattraverso il sistema [PagoFacile](https://pagofacile.popso.it/) nelle modalità di pagamento: \t-IUV utilizzando il Codice Avviso di Pagamento sulla stampa dell’avviso \toppure \t-utilizzando il circuito CBILL con il codice interbancario: F9489\n\ntramite Poste Italiane - [Paga online](https://www.poste.it/paga-online.html), utilizzando il bollettino postale integrato negli avvisi di pagamento [PagoPA](https://www.pagopa.gov.it/)\n\nNote:\n\nIl pagamento della 2° rata comporta l’accettazione della fascia di contribuzione attribuita; non sarà quindi possibile richiedere eventuali variazioni in diminuzione della fascia dopo aver effettuato il pagamento della 2° rata\n\nPer importi inferiori a 12,00 € non sarà disponibile nei [[Servizi Online](https://aunicalogin.polimi.it/aunicalogin/getservizio.xml?id_servizio=376)](https://aunicalogin.polimi.it/aunicalogin/getservizio.xml?id_servizio=376) il bollettino di pagamento, l’importo dovuto sarà automaticamente addebitato negli eventuali pagamenti successivi"
        ],
        "answer": "La maggiorazione per il ritardo nel pagamento delle tasse varia a seconda delle scadenze stabilite dall'università. Per conoscere l'importo esatto della maggiorazione per la tua rata scaduta, ti consiglio di consultare il sito ufficiale di POLIMI nella sezione relativa alle tasse e alle procedure amministrative. Lì troverai tutte le informazioni necessarie, compreso l'importo della maggiorazione e le modalità di pagamento."
    },
    {
        "question": "Ho redditi e patrimoni all'estero come presento l'Iseeu?",
        "ground_truths": [
            "Devi rivolgerti al CAF convenzionato per ottenere l'Iseeu-parificato entro le scadenze previste."
        ],
        "contexts": [
            "Studenti con reddito e patrimoni dichiarati e/o posseduti solo all'estero o all'estero e in Italia\n\nAnno accademico 2023/2024\n\nSe possiedi un reddito o un patrimonio all’estero (*) devi richiedere un documento, denominato ISEEU parificato, per il calcolo delle tasse universitarie. La richiesta dell'ISEEU parificato va inviata ai Centri di Assistenza Fiscale (CAF): saranno poi questi a trasmettere il documento al Politecnico. Non dovrai presentare nulla in Segreteria, e nemmeno registrare il dato attraverso i Servizi Online.\n\n(*) reddito e/o patrimonio (immobiliare e mobiliare), tuo e/o del tuo nucleo familiare, dichiarati e/o posseduti all'estero o all'estero e in Italia\n\nAttenzione: l'ISEEU parificato non consente di richiedere l'esonero parziale o totale ([Legge 232/2016 e successive modifiche](https://www.polimi.it/studenti-iscritti/tasse-borse-e-agevolazioni-economiche/contribuzione-studentesca/esoneri-previsti-dalla-legge-di-bilancio-2017))",
            "Qui di seguito sono illustrate le procedure per richiedere l'ISEEU parificato.\n\n1. Prepara i documenti da allegare alla domanda\n\nDocumenti necessari per il calcolo dell'ISEEU\n\ncomposizione del nucleo familiare estero (al momento della presentazione della domanda)\n\nreddito del secondo anno precedente alla richiesta di ciascun componente della famiglia (se uno o più componenti di età uguale o maggiore di 18 anni non hanno percepito redditi, è necessario presentare una dichiarazione in tal senso)\n\ndocumento relativo ai fabbricati e terreni di proprietà della famiglia alla data del 31 dicembre del secondo anno precedente alla richiesta, con indicazione dei metri quadrati, rilasciato dall'autorità pubblica in materia (se non risultasse alcun fabbricato, va prodotto un certificato che attesta l'assenza di proprietà di fabbricati per ogni membro del nucleo familiare che abbia età maggiore o uguale a 18 anni)\n\npatrimonio mobiliare posseduto alla data del 31 dicembre del secondo anno precedente alla richiesta dalla famiglia, con indicazione di titoli, dividendi, partecipazioni azionari, frazioni di patrimonio netto di eventuali aziende possedute)\n\nNota: deve essere dichiarata anche la presenza e consistenza di eventuali redditi e patrimonio posseduti in Italia. Si evidenzia inoltre che in assenza del requisito del reddito minimo percepito in Italia o all’estero dallo studente e previsto dalla normativa ISEE per essere considerato indipendente, si dovrà fare riferimento al proprio nucleo familiare di origine; in tal caso se i redditi e i patrimoni dello stesso sono all’estero lo studente deve presentare l’indicatore ISEEU PARIFICATO.",
            "Studenti dei campus di Cremona, Lecco, Mantova e Piacenza già in Italia\n\nSe si trovano già in Italia e non possono prendere un appuntamento presso le sedi di Milano, gli studenti dei campus di Cremona, Lecco, Mantova e Piacenza - seguendo le indicazioni della fase 1 e 2 (vedi sopra) - possono inviare la documentazione accedendo al [portale Digita](http://www.digitacgil.it/), indicando nella sezione “Allegati” e nel campo messaggi la propria sede campus. Verranno in seguito ricontattati dal CAF e invitati a consegnare i documenti originali in una delle sedi di Milano o nelle sedi di Cremona (via Mantova 25), di Lecco (via Besonda Inferiore 11) e di Mantova (via Argentina Altobelli, 5).\n\nGli studenti con reddito e patrimonio (immobiliare e mobiliare) proprio e/o del proprio nucleo familiare dichiarati e/o posseduti all'estero o all'estero ed in Italia, iscritti al primo anno di Laurea e Laurea Magistrale (compresi gli studenti che si iscriveranno a partire dal secondo semestre) che hanno ottenuto l’assegnazione della borsa per il diritto allo studio A.A. 2023/2024 e che intendono chiedere la graduazione del contributo onnicomprensivo, che rappresenta una parte delle tasse universitarie, devono rivolgersi al CAF indicato per ottenere l’indicatore ISEEU PARIFICATO. L’ISEEU PARIFICATO verrà trasmesso dal CAF al Politecnico di Milano.\n\nL'ISEEU PARIFICATO ai fini dell'emissione della 2° rata non è preso in considerazione per i seguenti studenti:\n\nGli studenti internazionali (appartenenti al contingente riservato Extra UE, cioè non equiparati agli studenti italiani) ammessi ai corsi di Laurea Magistrale con titolo di primo livello conseguito all’estero che sono assegnatari di una borsa di studio del Politecnico di Milano o di altri enti (ad esempio borsisti del governo italiano), diversa da quella assegnata per merito e reddito del diritto allo studio, che sono esonerati dal pagamento delle tasse e contributi, ad esclusione della quota relativa alla Tassa regionale e delle spese amministrative delle imposte di bollo"
        ],
        "answer": "Se possiedi redditi e patrimoni all'estero, devi richiedere un documento chiamato ISEEU parificato per il calcolo delle tasse universitarie. La richiesta dell'ISEEU parificato deve essere inviata ai Centri di Assistenza Fiscale (CAF), che trasmetteranno il documento al Politecnico di Milano. Non è necessario presentare nulla in Segreteria o registrare i dati tramite i Servizi Online. Per ulteriori informazioni sulle procedure per richiedere l'ISEEU parificato, puoi consultare il seguente [link](https://www.polimi.it/studenti-iscritti/tasse-borse-e-agevolazioni-economiche/contribuzione-studentesca/studenti-con-reddito-e-patrimonio-allestero)."
    },
    {
        "question": "Dove mi rivolgo per richiedere la Dichiarazione sostitutiva unica (DSU) e calcolo Isee?",
        "ground_truths": [
            "La Dichiarazione sostitutiva unica (DSU) può essere presentata:\n\nalle sedi Inps competenti per territorio\n\nai centri di assistenza fiscale (CAF)\n\nai comuni"
        ],
        "contexts": [
            "Cosa devi fare\n\nRecati presso un CAF o accedi autonomamente all'INPS per richiedere l'ISEE corrente\n\nInserisci nei [Servizi Online](https://aunicalogin.polimi.it/aunicalogin/getservizio.xml?id_servizio=376) la data di sottoscrizione della Dichiarazione Sostitutiva Unica che hai presentato per ottenere l’ISEE corrente\n\nSe per l’anno accademico corrente hai già inserito nei [Servizi Online](https://aunicalogin.polimi.it/aunicalogin/getservizio.xml?id_servizio=376) un’altra DSU in base alla quale ti è già stata assegnata una fascia di reddito, prima di procedere alla nuova registrazione contatta la [Segreteria Studenti](https://www.polimi.it/studenti-iscritti/sportelli-e-uffici-aperti-agli-studenti)\n\nUlteriori informazioni\n\nL’INPS mette a disposizione sul proprio sito una serie di informazioni utili:\n\n[La riforma dell’ISEE](https://servizi2.inps.it/servizi/Iseeriforma/Home.aspx)\n\n[Prestazioni welfare legati all’ISEE](https://www.inps.it/NuovoportaleINPS/default.aspx?sPathID=%3B0%3B49407%3B&lastMenu=49407&iMenu=1&sURL=%2FdocallegatiNP%2FMig%2FAllegati%2F525tabella_ISEE_2015_prestazioni_welfare.pdf&RedirectForzato=True)\n\n[Isee corrente](https://www.inps.it/it/it/inps-comunica/notizie/dettaglio-news-page.news.2021.09.isee-corrente-aggiornamento-redditi-e-patrimoni-nella-dsu.html)\n\nStudenti con redditi e patrimoni dichiarati e/o posseduti solo all'estero o all'estero e in Italia\n\nSe hai redditi e patrimoni all’estero, o all'estero e in Italia, non è possibile richiedere la certificazione ISEE. In questo caso, per ottenere agevolazioni sui contributi studenteschi, devi procurati un ISEEU parificato che è rilasciato dal CAF convenzionato con il Politecnico di Milano.\n\nNota: con questo indicatore non è possibile richiedere l'[esonero sulla base della Legge 232/2016](https://www.polimi.it/studenti-iscritti/tasse-borse-e-agevolazioni-economiche/contribuzione-studentesca/esoneri-previsti-dalla-legge-di-bilancio-2017) e successive modifiche e integrazioni.",
            "Qui di seguito sono illustrate le procedure per richiedere l'ISEEU parificato.\n\n1. Prepara i documenti da allegare alla domanda\n\nDocumenti necessari per il calcolo dell'ISEEU\n\ncomposizione del nucleo familiare estero (al momento della presentazione della domanda)\n\nreddito del secondo anno precedente alla richiesta di ciascun componente della famiglia (se uno o più componenti di età uguale o maggiore di 18 anni non hanno percepito redditi, è necessario presentare una dichiarazione in tal senso)\n\ndocumento relativo ai fabbricati e terreni di proprietà della famiglia alla data del 31 dicembre del secondo anno precedente alla richiesta, con indicazione dei metri quadrati, rilasciato dall'autorità pubblica in materia (se non risultasse alcun fabbricato, va prodotto un certificato che attesta l'assenza di proprietà di fabbricati per ogni membro del nucleo familiare che abbia età maggiore o uguale a 18 anni)\n\npatrimonio mobiliare posseduto alla data del 31 dicembre del secondo anno precedente alla richiesta dalla famiglia, con indicazione di titoli, dividendi, partecipazioni azionari, frazioni di patrimonio netto di eventuali aziende possedute)\n\nNota: deve essere dichiarata anche la presenza e consistenza di eventuali redditi e patrimonio posseduti in Italia. Si evidenzia inoltre che in assenza del requisito del reddito minimo percepito in Italia o all’estero dallo studente e previsto dalla normativa ISEE per essere considerato indipendente, si dovrà fare riferimento al proprio nucleo familiare di origine; in tal caso se i redditi e i patrimoni dello stesso sono all’estero lo studente deve presentare l’indicatore ISEEU PARIFICATO.",
            "Presentare l'ISEE rilasciato con data 2024\n\nLa presentazione dell'ISEE rilasciato con data 2024 è necessaria per richiedere l'eventuale esonero e la graduazione del contributo onnicomprensivo.\n\nProcedura: accedere ai [Servizi Online](https://aunicalogin.polimi.it/aunicalogin/getservizio.xml?id_servizio=376) (Dati > Tasse e agevolazioni economiche > Dichiarazione ISEE) e inserire la data di sottoscrizione della Dichiarazione Sostitutiva Unica (vale a dire il documento che lo studente ha presentato all'INPS per chiedere il calcolo dell'ISEE). Sarà cura del Politecnico di Milano ottenere dall'INPS la verifica della correttezza ed il valore dell'ISEE.\n\nNote:\n\nNon sono validi ISEE \"uso Università\" in riferimento al Codice fiscale dello studente con relativa Dichiarazione Sostitutiva Unica non riferite all'anno 2024, cioè presentate prima del 1 gennaio 2024.\n\nPer le seguenti categorie di studenti non è richiesta la presentazione dell’ISEE con data 2024, ai fini della determinazione dell'importo di seconda rata: 1) studenti idonei/beneficiari di borsa del Diritto allo Studio, iscritti ad anni successivi al primo anno di corso (Laurea, Laurea Magistrale, Laurea Magistrale a ciclo unico); 2) studenti internazionali extra-UE, cioè non equiparati agli studenti italiani con titolo di primo livello conseguito all’estero, iscritti ai corsi di Laurea Magistrale e non idonei/beneficiari di borsa del Diritto allo Studio; 3) studenti beneficiari di borsa di studio del Governo italiano."
        ],
        "answer": "Per richiedere la Dichiarazione Sostitutiva Unica (DSU) e calcolare l'ISEE, puoi rivolgerti a un CAF (Centro di Assistenza Fiscale) o accedere autonomamente al sito dell'INPS (Istituto Nazionale della Previdenza Sociale). \n\nSe preferisci recarti presso un CAF, puoi trovare quello più vicino a te consultando il sito dell'INPS. Una volta presso il CAF, potrai richiedere l'assistenza per compilare la DSU e calcolare l'ISEE.\n\nSe invece preferisci accedere autonomamente al sito dell'INPS, potrai trovare tutte le informazioni necessarie per compilare la DSU e calcolare l'ISEE. Ti consiglio di consultare il sito dell'INPS per avere tutte le indicazioni dettagliate e i documenti necessari per la richiesta.\n\nRicorda che per ottenere agevolazioni sui contributi studenteschi, potrebbe essere necessario richiedere un ISEEU parificato se hai redditi e patrimoni all'estero o all'estero e in Italia. Per ulteriori informazioni su questa procedura, ti consiglio di consultare il sito del Politecnico di Milano."
    },
    {
        "question": "Sono previsti esoneri totali o parziali dal pagamento delle tasse?",
        "ground_truths": [
            "Si, sono previsti esoneri per merito, studenti lavoratori, genitori studenti Erasmus doppia Laurea etc.\n\nTi ricordiamo che per ottenere gli esoneri è necessario presentare la domanda dal 15 gennaio 2024 al 25 marzo 2024."
        ],
        "contexts": [
            "Studenti al 1° anno di iscrizione\n\nTipo di esonero\n\nRequisiti richiesti\n\nEsonero totale\n\nISEE da 0 € a 22.000 €\n\nEsonero parziale\n\nISEE da 22.001 a 30.000 €\n\nStudenti al 2° anno di iscrizione\n\nTipo di esonero\n\nRequisiti richiesti\n\nEsonero totale\n\nISEE da 0 € a 22.000 €Minimo 10 CFU (*)\n\nEsonero parziale\n\nISEE da 22.001 a 30.000 € Minimo 10 CFU (*)\n\n(*) conseguiti entro il 10 agosto del 1° anno\n\nStudenti iscritti ad anni successivi al 2°\n\nTipo di esonero\n\nRequisiti richiesti\n\nEsonero totale\n\nISEE da 0 € a 22.000 € Minimo 25 CFU (*) Regolarità iscrizione (**)\n\nEsonero parziale\n\nISEE da 22.001 a 30.000 € Minimo 25 CFU (*)Regolarità iscrizione (**)\n\nEsonero parziale ridotto\n\nISEE da 0 a 30.000 €Minimo 25 CFU (*)\n\n(*) conseguiti nei 12 mesi antecedenti il 10 agosto che precede la relativa iscrizione\n\n(**) essere iscritti a un Corso di Studi da un numero di anni accademici inferiore o uguale alla durata normale del Corso di Studi aumentata di uno (Corsi di Laurea = 3+1, Corsi di Laurea Magistrale = 2+1; Corso di Laurea Magistrale a ciclo unico = 5+1)",
            "Esoneri previsti dalla legge di bilancio 2017 (e successive modifiche e integrazioni)\n\nAnno accademico 2023/2024\n\nLa Legge di Bilancio 2017 (L. 232/2016), e successive modifiche e integrazioni, prevede che gli studenti che rispettano determinate condizioni siano esonerati totalmente o parzialmente dal pagamento del contributo onnicomprensivo. Il diritto all’esonero dipende da una serie di requisiti che variano a seconda dell’anno di iscrizione dello studente.\n\nNota: con l’indicatore [ISEEU PARIFICATO](https://www.polimi.it/studenti-iscritti/tasse-borse-e-agevolazioni-economiche/contribuzione-studentesca/studenti-con-reddito-e-patrimonio-allestero) non è possibile richiedere l'esonero sulla base della Legge 232/2016 e successive modifiche e integrazioni.\n\n1. Requisiti richiesti",
            "5 - Esonero totale dal contributo onnicomprensivo previsto dall’art.30 legge 118/1971\n\nStudenti che appartengono a famiglie di disagiata condizione economica (Isee ≤ 22.000 €):\n\nmutilati e invalidi civili con diminuzione della capacità lavorativa superiore ai due terzi\n\nfigli di beneficiari della pensione di inabilità\n\norfani di guerra, mutilati e invalidi di guerra, ciechi civili, mutilati e invalidi di lavoro, di servizio e i loro figli\n\nLa richiesta va presentata attraverso i canali della [Segreteria Studenti](https://www.polimi.it/studenti-iscritti/sportelli-e-uffici-aperti-agli-studenti) entro la scadenza della prima rata o il conseguimento del titolo.\n\n6 - Ulteriori esoneri\n\nSul contributo onnicomprensivo (ricalcolato sulla base delle agevolazioni previste nei punti precedenti) sono previste altre possibilità di esonero che permettono di ridurre ulteriormente l'importo finale."
        ],
        "answer": "Sì, sono previsti esoneri totali o parziali dal pagamento delle tasse per gli studenti di POLIMI. Gli esoneri dipendono da diversi fattori, come l'anno di iscrizione dello studente e il suo ISEE (Indicatore della Situazione Economica Equivalente). \n\nPer gli studenti al primo anno di iscrizione, sono previsti esoneri totali per coloro che hanno un ISEE da 0 € a 22.000 € e esoneri parziali per coloro che hanno un ISEE da 22.001 € a 30.000 €.\n\nPer gli studenti al secondo anno di iscrizione, gli esoneri totali sono previsti per coloro che hanno un ISEE da 0 € a 22.000 € e hanno conseguito almeno 10 CFU entro il 10 agosto del primo anno. Gli esoneri parziali sono previsti per coloro che hanno un ISEE da 22.001 € a 30.000 € e hanno conseguito almeno 10 CFU entro il 10 agosto del primo anno.\n\nPer gli studenti iscritti ad anni successivi al secondo, gli esoneri totali sono previsti per coloro che hanno un ISEE da 0 € a 22.000 €, hanno conseguito almeno 25 CFU nei 12 mesi precedenti il 10 agosto che precede l'iscrizione e hanno regolarità di iscrizione. Gli esoneri parziali sono previsti per coloro che hanno un ISEE da 22.001 € a 30.000 €, hanno conseguito almeno 25 CFU nei 12 mesi precedenti il 10 agosto che precede l'iscrizione e hanno regolarità di iscrizione. È inoltre previsto un esonero parziale ridotto per coloro che hanno un ISEE da 0 € a 30.000 € e hanno conseguito almeno 25 CFU.\n\nÈ importante notare che questi requisiti possono variare, quindi ti consiglio di consultare il sito ufficiale di POLIMI per ulteriori informazioni sui requisiti specifici per gli esoneri dalle tasse. Puoi trovare ulteriori dettagli sui [requisiti e gli esoneri previsti dalla legge di bilancio 2017](https://www.polimi.it/studenti-iscritti/tasse-borse-e-agevolazioni-economiche/contribuzione-studentesca/esoneri-previsti-dalla-legge-di-bilancio-2017)."
    },
    {
        "question": "Come avviene il rimborso?",
        "ground_truths": [
            "Il rimborso è in automatico con accredito sul conto corrente a te intestato/cointestato registrato sui Servizi Online > Dati > Gestione delle modalità di pagamento > Aggiungi o modifica modalità di pagamento standard. Ad accertamento avvenuto del rimborso riceverai apposita comunicazione (e-mail) con le relative indicazioni."
        ],
        "contexts": [
            "Le Segreterie Amministrative del Politecnico di Milano non forniscono ulteriori informazioni inerenti alla dichiarazione dei redditi. Per informazioni più dettagliate rivolgiti all'Agenzia delle Entrate o all'intermediario che si occupa delle relative dichiarazioni dei redditi.\n\nRimborsi rinunciatari nuove matricole\n\nCon la presentazione della domanda di rinuncia agli studi entro le [scadenze previste](https://scadenziario.polimi.it/index.php?id=5&L=0&argomento=5), le nuove matricole avranno il rimborso della 1° rata di tasse.\n\nLo studente è tenuto ad indicare le modalità di pagamento che desidera per eventuali rimborsi accedendo ai [Servizi Online](https://aunicalogin.polimi.it/aunicalogin/getservizio.xml?id_servizio=376) > Dati > Gestione delle modalità di pagamento e aggiornare eventuali modifiche. In mancanza di tali indicazioni non sarà possibile procedere all'accredito dell'importo spettante.\n\nIl rimborsonon include l'imposta di bollo di 16 € e le assicurazioni (totale 9.59 €) e non è erogabile nel caso in cui siano stati richiesti certificati di iscrizione in bollo e siano stati utilizzati.\n\nAttenzione: Il conto corrente deve essere intestato/cointestato allo studente.\n\n[Per ulteriori informazioni](https://www.polimi.it/studenti-iscritti/interruzione-sospensione-rinuncia-decadenza/rinuncia-agli-studi)",
            "Come pagare le rate\n\ndalla tua pagina personale: \"Tasse universitarie\" > \"Ultima richiesta non pagata\", accedi alla piattaforma PagoPA, selezionando “Paga tramite PagoPA “- PAGA ON LINE: scegli, tra i metodi di pagamento proposti, \"Altri metodi di pagamento\", optando tra le opzioni proposte in base alla verifica dei limiti delle stesse, o \"Addebito in conto\" (se la tua banca offre il servizio MyBank)\n\ndalla tua pagina personale: \"Tasse universitarie\" > \"Ultima richiesta non pagata\", seleziona \"Paga tramite PagoPA\" - PAGA PIÙ TARDI: seleziona \"Modulo di pagamento.pdf\" e con l'avviso di pagamento potrai effettuare l'operazione allo sportello della tua banca, o attraverso Home Banking con PagoPA o circuito CBILL utilizzando il codice interbancario: F9489, oppure presso sportelli ATM abilitati\n\ndalla tua pagina personale: \"Tasse universitarie\" > \"Ultima richiesta non pagata\", seleziona \"Paga tramite PagoPA\", scegli come metodo di pagamento [SCRIGNO PAGO FACILE](https://www.popso.it/app)\n\nAttenzione: si consiglia di verificare che le tempistiche legate alle diverse modalità di pagamento non comportino il superamento delle date di scadenza. Dopo avere pagato non è necessario presentare in Segreteria alcun documento. Potrai controllare la registrazione dell’avvenuto pagamento sui Servizi Online > Dati > Tasse e agevolazioni economiche > Storico pagamenti.",
            "Detrazioni e rimborsi\n\nAnno accademico 2023/2024\n\nDetrazione delle spese per la formazione universitaria\n\nLe spese per l’istruzione e la formazione universitaria sono considerate oneri per i quali è riconosciuta una detrazione d’imposta del 19%.\n\nPer i pagamenti effettuati tramite PagoPA è possibile scaricare dai [Servizi OnLine](https://aunicalogin.polimi.it/aunicalogin/getservizio.xml?id_servizio=376) (alla voce \"Tasse e agevolazioni economiche\", selezionando \"Storico pagamenti\") la \"ricevuta telematica\".\n\nOppure in alternativa puoi scaricare dai Servizi Online una \"Quietanza\" eventualmente soggetta a bollo:\n\nper importi inferiori a 77,47 € puoi salvare copia dell'attestazione cliccando su \"Salva Quietanza\"\n\nper importi superiori a 77,47 € è necessario prima pagare un'imposta di bollo di 2 €. Utilizza la funzionalità \"Paga bollo per Quietanza\" che consente di accedere alla piattaforma PagoPA per effettuare il pagamento. Solo quando il pagamento del bollo risulterà contabilizzato, sarà resa disponibile la funzionalità \"Salva Quietanza\"\n\nSi informa che i dati relativi alle tasse pagate vengono comunicati all’[Agenzia delle Entrate](https://www.agenziaentrate.gov.it/portale/schede/comunicazioni/opposizioni-utilizzo-delle-spese/opposizione-utilizzo-delle-spese-universitarie/informazioni-generali-opposizione-utilizzo-delle-spese-universitarie) al fine del loro inserimento nel 730 precompilato. Le spese universitarie che sono comunicate riguardano il totale delle spese sostenute nell'anno civile per iscrizione, tasse e contributi universitari al netto dei rimborsi relativi alle spese sostenute nello stesso anno civile.\n\nGli studenti che volessero opporsi (vedi [Agenzia delle Entrate](https://www.agenziaentrate.gov.it/portale/schede/comunicazioni/opposizioni-utilizzo-delle-spese/opposizione-utilizzo-delle-spese-universitarie/informazioni-generali-opposizione-utilizzo-delle-spese-universitarie)) all’inserimento di tali dati nella dichiarazione precompilata possono comunicarlo nel periodo previsto dall’[Agenzia delle Entrate](https://www.agenziaentrate.gov.it/portale/schede/comunicazioni/opposizioni-utilizzo-delle-spese/opposizione-utilizzo-delle-spese-universitarie/informazioni-generali-opposizione-utilizzo-delle-spese-universitarie) seguendo le indicazioni fornite dalla stessa."
        ],
        "answer": "Il rimborso delle tasse avviene nel caso in cui uno studente presenti una domanda di rinuncia agli studi entro le scadenze previste. Le nuove matricole possono ottenere il rimborso della prima rata di tasse. Lo studente deve indicare le modalità di pagamento desiderate per il rimborso accedendo ai Servizi Online e aggiornando eventuali modifiche. È importante notare che il rimborso non include l'imposta di bollo e le assicurazioni e non è erogabile nel caso in cui siano stati richiesti certificati di iscrizione in bollo e siano stati utilizzati. Per ulteriori informazioni, puoi consultare il seguente link: [Rimborsi rinunciatari nuove matricole](https://www.polimi.it/studenti-iscritti/interruzione-sospensione-rinuncia-decadenza/rinuncia-agli-studi)"
    },
    {
        "question": "Posso ottenere un rimborso per l'esame di lingua inglese?",
        "ground_truths": [
            "Si è previsto il rimborso di € 100,00 se hai ottenuto un punteggio utile per l'accesso alle lauree magistrali, per un solo esame superato durante il percorso di studi triennale presso il Politecnico di MIlano.\n\nIl rimborso viene erogato in automatico non devi presentare nessuna richiesta.\n\nVisita la pagina: Agevolazioni economiche previste"
        ],
        "contexts": [
            "2. Studenti che presentano certificazione linguistica\n\nSe sei uno studente dei corsi di Laurea del Politecnico e devi sostenere il test di lingua inglese, l’Ateneo ti riconosce un rimborso forfettario pari a 100,00 € a copertura delle spese richieste.\n\n[Per ulteriori informazioni](https://www.polimi.it/studenti-iscritti/requisiti-lingue-inglese-e-italiano/agevolazioni-economiche-previste)\n\nINDIRIZZO",
            "È inoltre previsto l'esonero totale dal contributo onnicomprensivo per studenti stranieri beneficiari di borsa di studio annuale del Governo italiano: contattare [international-scholarships@polimi.it](mailto:international-scholarships@polimi.it)\n\n7 - Agevolazioni per studenti prossimi alla conclusione degli studi\n\nSono infine previste agevolazioni per gli studenti prossimi alla conclusione degli studi e per gli studenti dei Corsi di Laurea che presentano una certificazione linguistica idonea a proseguire gli studi alla Laurea Magistrale.\n\nMaggiori informazioni\n\nAltre informazioni\n\nScadenze e procedure amministrative\n\nCos'è l'ISEE\n\nInformazioni sulle tasse per corsi singoli e integrazioni curriculari\n\nDetrazioni e Rimborsi\n\nCategorie particolari di studenti\n\nStudenti con reddito e patrimonio all'estero\n\nStudenti del corso di Ingegneria Informatica Online\n\nRifugiati politici",
            "Tale agevolazione non sarà attribuita in caso di presentazione di un Piano degli Studi per l’ulteriore anno accademico che preveda l’inserimento di insegnamenti in soprannumero.\n\nGli studenti iscritti ad un corso di laurea di ordinamenti antecedenti al DM 509/ 1999 possono usufruire della medesima agevolazione se devono sostenere non più di tre esami.  La registrazione dell’attestazione Isee 2024, come sopra indicato, dovrà avvenire almeno 10 giorni prima dell’iscrizione all’appello di laurea; per l’Iseeu parificato 2024 si dovrà inviare la documentazione necessaria e richiedere esplicitamente al CAF la trasmissione della pratica al Politecnico prima dell’iscrizione all’appello di laurea.\n\nIn assenza di Isee 2024 all’atto dell’iscrizione all’appello di laurea sarà considerato, se registrato, l’Isee 2023.\n\nNel caso in cui gli studenti di cui sopra non si laureino entro i termini indicati, il contributo onnicomprensivo annuo, dovuto in base al numero CFU e Isee 2024, sarà pari al 100%; l’eventuale conguaglio verrà richiesto con la 2° rata.\n\nB) se si laureano in appelli successivi all'ultima sessione di laurea dell'anno accademico precedente (da luglio 2024 e successivi appelli), hanno un Piano degli Studi completo per l’anno accademico precedente (2022/2023) ed hanno sostenuto tutti gli esami di profitto, compresi gli eventuali insegnamenti in posizione di soprannumero e le righe di piano di tipo tirocinio, negli appelli dell’anno accademico precedente, l’importo del contributo onnicomprensivo sarà pari al 25% dell'importo dovuto. In questo caso, se si tratta di studenti iscritti al corso di laurea Informatica Online, saranno esonerati anche dal contributo spese per l’utilizzo della relativa piattaforma."
        ],
        "answer": "Sì, se sei uno studente dei corsi di Laurea del Politecnico di Milano e devi sostenere il test di lingua inglese, l'Ateneo ti riconosce un rimborso forfettario pari a 100,00 € a copertura delle spese richieste. Per ulteriori informazioni su questa agevolazione, puoi consultare il seguente [link](https://www.polimi.it/studenti-iscritti/requisiti-lingue-inglese-e-italiano/agevolazioni-economiche-previste)."
    },
    {
        "question": "Mi serve la ricevuta di pagamento delle tasse universitarie, come posso ottenerla?",
        "ground_truths": [
            "Attraverso i Servizi Online alla voce Tasse e Agevolazioni economiche e poi nel menù Storico Pagamenti. \nEffettuando il pagamento della relativa marca da bollo da 2 euro, potrai stampare la quietanza relativa ad importi superiori a 77.74 €, per gli importi inferiori invece stampa direttamente il file."
        ],
        "contexts": [
            "Come pagare le rate\n\ndalla tua pagina personale: \"Tasse universitarie\" > \"Ultima richiesta non pagata\", accedi alla piattaforma PagoPA, selezionando “Paga tramite PagoPA “- PAGA ON LINE: scegli, tra i metodi di pagamento proposti, \"Altri metodi di pagamento\", optando tra le opzioni proposte in base alla verifica dei limiti delle stesse, o \"Addebito in conto\" (se la tua banca offre il servizio MyBank)\n\ndalla tua pagina personale: \"Tasse universitarie\" > \"Ultima richiesta non pagata\", seleziona \"Paga tramite PagoPA\" - PAGA PIÙ TARDI: seleziona \"Modulo di pagamento.pdf\" e con l'avviso di pagamento potrai effettuare l'operazione allo sportello della tua banca, o attraverso Home Banking con PagoPA o circuito CBILL utilizzando il codice interbancario: F9489, oppure presso sportelli ATM abilitati\n\ndalla tua pagina personale: \"Tasse universitarie\" > \"Ultima richiesta non pagata\", seleziona \"Paga tramite PagoPA\", scegli come metodo di pagamento [SCRIGNO PAGO FACILE](https://www.popso.it/app)\n\nAttenzione: si consiglia di verificare che le tempistiche legate alle diverse modalità di pagamento non comportino il superamento delle date di scadenza. Dopo avere pagato non è necessario presentare in Segreteria alcun documento. Potrai controllare la registrazione dell’avvenuto pagamento sui Servizi Online > Dati > Tasse e agevolazioni economiche > Storico pagamenti.",
            "Pagare la 1° e la 2° rata delle tasse\n\nTramite sistema [PagoPA](https://www.pagopa.gov.it/):\n\nattraverso i [[Servizi Online](https://aunicalogin.polimi.it/aunicalogin/getservizio.xml?id_servizio=376)](https://aunicalogin.polimi.it/aunicalogin/getservizio.xml?id_servizio=376)\n\ncon l'apposito modulo di pagamento nei [[Servizi Online](https://aunicalogin.polimi.it/aunicalogin/getservizio.xml?id_servizio=376)](https://aunicalogin.polimi.it/aunicalogin/getservizio.xml?id_servizio=376) > Tasse e agevolazioni economiche > Ultima richiesta non pagata, utilizzabile presso i punti di pagamento convenzionati con il sistema [PagoPA](https://www.pagopa.gov.it/) (tutti i principali istituti di credito, tranne gli uffici di Poste Italiane)\n\nattraverso il sistema [PagoFacile](https://pagofacile.popso.it/) nelle modalità di pagamento: \t-IUV utilizzando il Codice Avviso di Pagamento sulla stampa dell’avviso \toppure \t-utilizzando il circuito CBILL con il codice interbancario: F9489\n\ntramite Poste Italiane - [Paga online](https://www.poste.it/paga-online.html), utilizzando il bollettino postale integrato negli avvisi di pagamento [PagoPA](https://www.pagopa.gov.it/)\n\nNote:\n\nIl pagamento della 2° rata comporta l’accettazione della fascia di contribuzione attribuita; non sarà quindi possibile richiedere eventuali variazioni in diminuzione della fascia dopo aver effettuato il pagamento della 2° rata\n\nPer importi inferiori a 12,00 € non sarà disponibile nei [[Servizi Online](https://aunicalogin.polimi.it/aunicalogin/getservizio.xml?id_servizio=376)](https://aunicalogin.polimi.it/aunicalogin/getservizio.xml?id_servizio=376) il bollettino di pagamento, l’importo dovuto sarà automaticamente addebitato negli eventuali pagamenti successivi",
            "La scadenza per il pagamento della prima rata delle tasse dell'anno accademico 2023/2024 è il 13 settembre 2023, fatta eccezione per gli studenti indicati qui di seguito.\n\nQUALI STUDENTI POSSONO PAGARE LA PRIMA RATA DELLE TASSE OLTRE LA SCADENZA DEL 13 SETTEMBRE 2023 SENZA INCORRERE NELLA MAGGIORAZIONE PER IL RITARDO?\n\nStudenti di Laurea (triennale)\n\nChi ha necessità di presentare un piano degli studi per l'anno accademico 2023/2024 \"identico\" (senza alcuna modifica) a quello dell'anno 2022/2023 al solo fine di poter sostenere esami del primo semestre a marzo 2024\n\nChi non riesce a laurearsi nella sessione di marzo 2024\n\nStudenti di Laurea Magistrale (biennale)\n\nChi ha la necessità di sostenere solo esami del primo semestre per i quali è richiesta l’iscrizione al nuovo anno accademico\n\nChi non riesce a laurearsi nella sessione di aprile 2024\n\nSolo per questi studenti la scadenza da rispettare per non incorrere nella maggiorazione è il giorno 22 marzo 2024.\n\nAlcune operazioni amministrative potrebbero richiedere il pagamento della prima rata per poter procedere, ad esempio, all’iscrizione (per gli studenti con un piano completo) agli appelli d’esame dell'anno accademico 2023/2024 o alla registrazione in carriera dell'esito di un esame svolto in una sessione dell'anno accademico 2023/2024. Tali operazioni prevedono che sia stata pagata la rata di iscrizione, pertanto lo studente che si trova in una di queste situazioni dovrà essere in regola con tutti i pagamenti."
        ],
        "answer": "Per ottenere la ricevuta di pagamento delle tasse universitarie, puoi seguire questi passaggi:\n\n1. Accedi alla tua pagina personale dei Servizi Online di POLIMI.\n2. Seleziona la sezione \"Tasse universitarie\".\n3. Cerca l'ultima richiesta di pagamento non pagata e seleziona l'opzione \"Paga tramite PagoPA\".\n4. Scegli il metodo di pagamento desiderato tra quelli disponibili, come ad esempio il pagamento online o l'addebito in conto.\n5. Completa il pagamento seguendo le istruzioni fornite dal sistema PagoPA.\n6. Dopo aver effettuato il pagamento, potrai controllare la registrazione dell'avvenuto pagamento nella sezione \"Storico pagamenti\" dei Servizi Online.\n\nRicorda che non è necessario presentare alcun documento in segreteria dopo aver effettuato il pagamento. La ricevuta di pagamento sarà disponibile direttamente nella sezione \"Storico pagamenti\" dei Servizi Online.\n\nPer ulteriori informazioni e dettagli sulle procedure di pagamento delle tasse universitarie, puoi consultare il seguente [link](https://www.polimi.it/studenti-iscritti/tasse-borse-e-agevolazioni-economiche/contribuzione-studentesca/scadenze-e-procedure-amministrative)."
    },
    {
        "question": "Sono uno studente prossimo alla laurea, devo pagare le tasse?",
        "ground_truths": [
            "Per capire se devi pagare la rata d'iscrizione devi consultare la sezione:\nStudenti prossimi alla conclusione degli studi"
        ],
        "contexts": [
            "Quanto si paga in un anno accademico\n\nPrima e seconda rata\n\nDetrazione spese universitarie\n\nRimborso delle tasse (a seguito di rinuncia agli studi)\n\nQuanto si paga in un anno accademico\n\nL’importo delle tasse universitarie è variabile in funzione del piano degli studi che presenterai e dalla condizione economica, determinata dall’[ISEE](https://www.polimi.it/studenti-iscritti/tasse-borse-e-agevolazioni-economiche/contribuzione-studentesca/cose-lisee) (Indicatore della Situazione Economica Equivalente). Le rate sono due e vanno pagate ciascuna in un’unica soluzione.\n\nCon un [piano degli studi standard](https://www.polimi.it/studenti-iscritti/piano-degli-studi-e-ofa-di-inglese-e-italiano/cose-il-piano-degli-studi) tra i 46 e i 74 CFU (Credti Formativi Universitari) e un [ISEE](https://www.polimi.it/studenti-iscritti/tasse-borse-e-agevolazioni-economiche/contribuzione-studentesca/cose-lisee) fino a € 22.000, l’importo è di € 165.59; per Isee di valori superiori, l’importo aumenta gradualmente fino ad un massimo di € 3.891,59. In particolare, per [ISEE](https://www.polimi.it/studenti-iscritti/tasse-borse-e-agevolazioni-economiche/contribuzione-studentesca/cose-lisee) compresi tra i € 22.001 e € 30.000 l’importo è calcolato con una [specifica formula](https://www.polimi.it/studenti-iscritti/tasse-borse-e-agevolazioni-economiche/contribuzione-studentesca/esoneri-previsti-dalla-legge-di-bilancio-2017); per [ISEE](https://www.polimi.it/studenti-iscritti/tasse-borse-e-agevolazioni-economiche/contribuzione-studentesca/cose-lisee) superiori a € 30.000, l’importo è definito in base alle [fasce di contribuzione](https://www.polimi.it/studenti-iscritti/tasse-borse-e-agevolazioni-economiche/contribuzione-studentesca/graduazione-del-contributo-onnicomprensivo). A questi importi viene poi applicata la [percentuale corrispondente al numero di CFU](https://www.polimi.it/studenti-iscritti/tasse-borse-e-agevolazioni-economiche/contribuzione-studentesca/commisurazione-dellimporto-onnicomprensivo-sulla-base-dei-cfu) del piano studi.\n\nN.B. Gli studenti internazionali (appartenenti al contingente riservato extra UE, cioè non equiparati agli studenti italiani), ammessi ai corsi di laurea magistrale con titolo di primo livello conseguito all’estero che non sono assegnatari di una borsa di studio del Politecnico di Milano o di altri enti, o di borsa assegnata per merito e reddito del Diritto allo Studio, sono tenuti al pagamento dell’importo massimo rapportato alla [percentuale corrispondente al numero di CFU](https://www.polimi.it/studenti-iscritti/tasse-borse-e-agevolazioni-economiche/contribuzione-studentesca/commisurazione-dellimporto-onnicomprensivo-sulla-base-dei-cfu) del piano degli studi.",
            "La scadenza per il pagamento della prima rata delle tasse dell'anno accademico 2023/2024 è il 13 settembre 2023, fatta eccezione per gli studenti indicati qui di seguito.\n\nQUALI STUDENTI POSSONO PAGARE LA PRIMA RATA DELLE TASSE OLTRE LA SCADENZA DEL 13 SETTEMBRE 2023 SENZA INCORRERE NELLA MAGGIORAZIONE PER IL RITARDO?\n\nStudenti di Laurea (triennale)\n\nChi ha necessità di presentare un piano degli studi per l'anno accademico 2023/2024 \"identico\" (senza alcuna modifica) a quello dell'anno 2022/2023 al solo fine di poter sostenere esami del primo semestre a marzo 2024\n\nChi non riesce a laurearsi nella sessione di marzo 2024\n\nStudenti di Laurea Magistrale (biennale)\n\nChi ha la necessità di sostenere solo esami del primo semestre per i quali è richiesta l’iscrizione al nuovo anno accademico\n\nChi non riesce a laurearsi nella sessione di aprile 2024\n\nSolo per questi studenti la scadenza da rispettare per non incorrere nella maggiorazione è il giorno 22 marzo 2024.\n\nAlcune operazioni amministrative potrebbero richiedere il pagamento della prima rata per poter procedere, ad esempio, all’iscrizione (per gli studenti con un piano completo) agli appelli d’esame dell'anno accademico 2023/2024 o alla registrazione in carriera dell'esito di un esame svolto in una sessione dell'anno accademico 2023/2024. Tali operazioni prevedono che sia stata pagata la rata di iscrizione, pertanto lo studente che si trova in una di queste situazioni dovrà essere in regola con tutti i pagamenti.",
            "Attenzione: per le agevolazioni sopra descritte, sarà attribuito il solo beneficio economico più vantaggioso per lo studente, in caso di contemporanea assegnazione delle [categorie previste come ulteriori esoneri](https://www.polimi.it/studenti-iscritti/tasse-borse-e-agevolazioni-economiche/contribuzione-studentesca/altre-possibilita-di-esonero-previste-dal-politecnico).\n\nCHI SONO GLI STUDENTI CHE NON DEVONO PRENDERE ISCRIZIONE ALL'A.A. 2023/2024 (CIOÈ NON DEVONO PAGARE LA PRIMA RATA 2023/2024)?\n\nStudenti di Laurea (triennale):\n\nChi si laurea nella sessione di settembre 2023\n\nChi si laurea nella sessione di marzo 2024 e deve sostenere solo esami del secondo semestre 2022/2023 (senza dover presentare un Piano degli Studi per l’anno accademico 2023/2024)\n\nStudenti di Laurea Magistrale (biennale):\n\nChi si laurea nella sessione di ottobre o in quella di dicembre 2023 (senza avere fatto un Piano degli Studi per l'anno accademico 2023/2024)\n\nChi si laurea nella sessione di aprile 2024 e deve sostenere solo esami del secondo semestre 2022/2023 (senza avere fatto un Piano degli Studi per l'anno accademico 2023/2024)\n\nCHI SONO GLI STUDENTI CHE DEVONO PAGARE LA PRIMA RATA DELLE TASSE DELL'A.A. 2023/2024?\n\nChi presenta domanda di concorso per i benefici del Diritto allo Studio anno accademico 2023/2024\n\nChi si laurea entro la sessione di marzo 2024 (per la Laurea Triennale) o aprile 2024 (per la Laurea Magistrale) e ha avuto la necessità presentare un piano degli studi dell'anno accademico 2023/2024 e/o deve sostenere esami del primo semestre e/o ha la necessità di richiedere una certificazione relativa all’iscrizione all’anno accademico 2023/2024\n\nQUANDO DEVO PAGARE LA PRIMA RATA DELLE TASSE DELL'A.A. 2023/2024 SENZA INCORRERE NELLA MAGGIORAZIONE PER IL RITARDO?"
        ],
        "answer": "Per conoscere l'importo delle tasse che devi pagare per l'anno accademico corrente, ti consiglio di consultare il sito ufficiale del Politecnico di Milano. L'importo delle tasse varia in base al piano di studi e alla tua situazione economica, determinata dall'ISEE (Indicatore della Situazione Economica Equivalente). Puoi trovare tutte le informazioni dettagliate sulle tasse universitarie e sulle modalità di pagamento sul sito ufficiale del Politecnico di Milano. (fonte: <a href=\"https://www.polimi.it/futuri-studenti/tasse/lauree-e-lauree-magistrali\">Politecnico di Milano - Tasse</a>)"
    },
    {
        "question": "Ho richiesto per sbaglio lo IUV del pagamento della prima rata, cosa devo fare?",
        "ground_truths": [
            "Se non devi o vuoi iscriverti all'anno accademico non pagare lo IUV.\nLa generazione dello IUV non comporta l'obbligo del pagamento e non è possibile eliminare lo IUV generato."
        ],
        "contexts": [
            "Attenzione: l'emissione del bollettino di pagamento di seconda rata avverrà indipendentemente dalla richiesta di assegnazione di una fascia inferiore al contributo pieno. Il pagamento in ritardo della rata comporterà l’attribuzione di un’ulteriore maggiorazione dovuta in relazione al ritardo nel pagamento. In caso di registrazione in ritardo della sottoscrizione ISEE 2024, nei Servizi Online occorrerà comunicare espressamente alla Segreteria studenti la necessità di generare un bollettino di pagamento aggiornato.\n\nIn mancanza di un ISEE valido e in ogni caso dopo il pagamento della seconda rata, non è concessa nessuna riduzione del contributo onnicomprensivo pieno.\n\nMaggiori informazioni sull'ISEE\n\nL’indicatore ISEE è rilasciato dall’INPS e puoi rivolgerti ad un CAF per avere assistenza e supporto. Puoi trovare tutte le informazioni necessarie ed un simulatore per il calcolo sul sito dell'INPS> Prestazioni e servizi > Tutti i servizi > [ISEE Post-riforma 2015](https://servizi2.inps.it/servizi/iseeriforma/home.aspx). L’ISEE deve essere rilasciato \"uso Università\" in riferimento al codice fiscale dello studente e non deve contenere “omissioni/difformità/discordanze”. Gli studenti sono obbligati a dichiarare tutti i redditi, il patrimonio mobiliare e immobiliare previsti dalla normativa ISEE e sono responsabili della completezza e della conformità alla normativa citata della propria dichiarazione ISEE.\n\n[Maggiori informazioni](https://www.polimi.it/studenti-iscritti/tasse-borse-e-agevolazioni-economiche/contribuzione-studentesca/cose-lisee)",
            "La scadenza per il pagamento della prima rata delle tasse dell'anno accademico 2023/2024 è il 13 settembre 2023, fatta eccezione per gli studenti indicati qui di seguito.\n\nQUALI STUDENTI POSSONO PAGARE LA PRIMA RATA DELLE TASSE OLTRE LA SCADENZA DEL 13 SETTEMBRE 2023 SENZA INCORRERE NELLA MAGGIORAZIONE PER IL RITARDO?\n\nStudenti di Laurea (triennale)\n\nChi ha necessità di presentare un piano degli studi per l'anno accademico 2023/2024 \"identico\" (senza alcuna modifica) a quello dell'anno 2022/2023 al solo fine di poter sostenere esami del primo semestre a marzo 2024\n\nChi non riesce a laurearsi nella sessione di marzo 2024\n\nStudenti di Laurea Magistrale (biennale)\n\nChi ha la necessità di sostenere solo esami del primo semestre per i quali è richiesta l’iscrizione al nuovo anno accademico\n\nChi non riesce a laurearsi nella sessione di aprile 2024\n\nSolo per questi studenti la scadenza da rispettare per non incorrere nella maggiorazione è il giorno 22 marzo 2024.\n\nAlcune operazioni amministrative potrebbero richiedere il pagamento della prima rata per poter procedere, ad esempio, all’iscrizione (per gli studenti con un piano completo) agli appelli d’esame dell'anno accademico 2023/2024 o alla registrazione in carriera dell'esito di un esame svolto in una sessione dell'anno accademico 2023/2024. Tali operazioni prevedono che sia stata pagata la rata di iscrizione, pertanto lo studente che si trova in una di queste situazioni dovrà essere in regola con tutti i pagamenti.",
            "Per ottenere una riduzione dell’importo massimo della seconda rata devi:\n\nrichiedere, a partire da gennaio, un nuovo calcolo dell’ISEE per uso universitario all’INPS o a un CAF; se hai redditi o patrimoni all’estero o all’estero e in Italia, devi richiedere il calcolo [dell’ISEEU parificato](https://www.polimi.it/studenti-iscritti/tasse-borse-e-agevolazioni-economiche/contribuzione-studentesca/studenti-con-reddito-e-patrimonio-allestero) secondo le procedure descritte nella pagina dedicata\n\nin attesa di ricevere l’ISEE, devi inserire nei [Servizi Online](https://aunicalogin.polimi.it/aunicalogin/getservizio.xml?id_servizio=376) [Dati >Tasse e agevolazioni economiche > Dichiarazione ISEE], la data della sottoscrizione della Dichiarazione Sostitutiva Unica\n\nAttenzione: l’importo massimo è richiesto in automatico agli studenti che non presentano un ISEE e agli studenti internazionali (appartenenti al contingente riservato Extra UE, cioè non equiparati agli studenti italiani), iscritti ai corsi di Laurea Magistrale con titolo di primo livello conseguito all’estero e non assegnatari di una Borsa di studio del Politecnico di Milano o di altri Enti, anche se presentano ISEEU parificato.\n\nLa seconda rata con il relativo importo sarà disponibile nei [Servizi Online](https://aunicalogin.polimi.it/aunicalogin/getservizio.xml?id_servizio=376), indicativamente un mese prima rispetto alla [scadenza](https://scadenziario.polimi.it/index.php?id=5&L=0) per il pagamento, da effettuare, entro i termini previsti, accedendo ai [Servizi Online](https://aunicalogin.polimi.it/aunicalogin/getservizio.xml?id_servizio=376) (Dati >Tasse e agevolazioni economiche > selezionando \"Ultima richiesta non pagata\").\n\nSe vuoi approfondire la questione delle rate, visita la [sezione dedicata alla contribuzione studentesca](https://www.polimi.it/studenti-iscritti/tasse-borse-e-agevolazioni-economiche/contribuzione-studentesca/studenti-con-reddito-e-patrimonio-allestero)."
        ],
        "answer": "Se hai richiesto per errore lo IUV del pagamento della prima rata, ti consiglio di contattare il servizio di segreteria studenti di POLIMI. Possono fornirti assistenza e indicarti la procedura corretta da seguire per risolvere il problema. Puoi trovare i contatti della segreteria studenti sul sito ufficiale di POLIMI."
    }
]